id,name,original_metadata,unit,short_unit,description,code,coverage,timespan,display,source_id,dataset_id
197,"Employment in services, female (% of female employment) (modeled ILO estimate)",,modeled ILO estimate,,"Employment is defined as persons of working age who were engaged in any activity to produce goods or provide services for pay or profit, whether at work during the reference period or not at work due to temporary absence from a job, or to working-time arrangement. The services sector consists of wholesale and retail trade and restaurants and hotels; transport, storage, and communications; financing, insurance, real estate, and business services; and community, social, and personal services, in accordance with divisions 6-9 (ISIC 2) or categories G-Q (ISIC 3) or categories G-U (ISIC 4).",SL.SRV.EMPL.FE.ZS,,1991-2019,{},40,0
198,"Employment in services, male (% of male employment) (modeled ILO estimate)",,modeled ILO estimate,,"Employment is defined as persons of working age who were engaged in any activity to produce goods or provide services for pay or profit, whether at work during the reference period or not at work due to temporary absence from a job, or to working-time arrangement. The services sector consists of wholesale and retail trade and restaurants and hotels; transport, storage, and communications; financing, insurance, real estate, and business services; and community, social, and personal services, in accordance with divisions 6-9 (ISIC 2) or categories G-Q (ISIC 3) or categories G-U (ISIC 4).",SL.SRV.EMPL.MA.ZS,,1991-2019,{},40,0
205,"Labor force participation rate for ages 15-24, female (%) (national estimate)",,national estimate,,Labor force participation rate for ages 15-24 is the proportion of the population ages 15-24 that is economically active: all people who supply labor for the production of goods and services during a specified period.,SL.TLF.ACTI.1524.FE.NE.ZS,,1960-2020,{},40,0
211,"Share of youth not in education, employment or training, total (% of youth population)",,% of youth population,%,"Share of youth not in education, employment or training (NEET) is the proportion of young people who are not in education, employment, or training to the population of the corresponding age group: youth (ages 15 to 24); persons ages 15 to 29; or both age groups.",SL.UEM.NEET.ZS,,1976-2020,{},40,0
202,"Average working hours of children, study and work, ages 7-14 (hours per week)",,hours per week,hours,Average working hours of children studying and working refer to the average weekly working hours of those children who are attending school in combination with economic activity.,SL.TLF.0714.SW.TM,,1999-2016,{},63,0
200,"Children in employment, female (% of female children ages 7-14)",,% of female children ages 7-14,%,Children in employment refer to children involved in economic activity for at least one hour in the reference week of the survey.,SL.TLF.0714.FE.ZS,,1994-2016,{},63,0
201,"Children in employment, male (% of male children ages 7-14)",,% of male children ages 7-14,%,Children in employment refer to children involved in economic activity for at least one hour in the reference week of the survey.,SL.TLF.0714.MA.ZS,,1994-2016,{},63,0
204,"Children in employment, total (% of children ages 7-14)",,% of children ages 7-14,%,Children in employment refer to children involved in economic activity for at least one hour in the reference week of the survey.,SL.TLF.0714.ZS,,1994-2016,{},63,0
203,"Children in employment, work only (% of children in employment, ages 7-14)",,"% of children in employment, ages 7-14",%,Children in employment refer to children involved in economic activity for at least one hour in the reference week of the survey. Work only refers to children involved in economic activity and not attending school.,SL.TLF.0714.WK.ZS,,1994-2016,{},63,0
108,Adequacy of social insurance programs (% of total welfare of beneficiary households),,% of total welfare of beneficiary households,%,"Adequacy of social insurance programs is measured by the total transfer amount received by the population participating in social insurance programs as a share of their total welfare. Welfare is defined as the total income or total expenditure of beneficiary households. Social insurance programs include old age contributory pensions (including survivors and disability) and social security and health insurance benefits (including occupational injury benefits, paid sick leave, maternity and other social insurance). Estimates include both direct and indirect beneficiaries.",PER_SI_ALLSI.ADQ_POP_TOT,,1998-2019,{},6,0
107,Adequacy of social safety net programs (% of total welfare of beneficiary households),,% of total welfare of beneficiary households,%,"Adequacy of social safety net programs is measured by the total transfer amount received by the population participating in social safety net programs as a share of their total welfare. Welfare is defined as the total income or total expenditure of beneficiary households. Social safety net programs include cash transfers and last resort programs, noncontributory social pensions, other cash transfers programs (child, family and orphan allowances, birth and death grants, disability benefits, and other allowances), conditional cash transfers, in-kind food transfers (food stamps and vouchers, food rations, supplementary feeding, and emergency food distribution), school feeding, other social assistance programs (housing allowances, scholarships, fee waivers, health subsidies, and other social assistance) and public works programs (cash for work and food for work). Estimates include both direct and indirect beneficiaries.",PER_SA_ALLSA.ADQ_POP_TOT,,1998-2019,{},6,0
109,Coverage of social insurance programs (% of population),,% of population,%,"Coverage of social insurance programs shows the percentage of population participating in programs that provide old age contributory pensions (including survivors and disability) and social security and health insurance benefits (including occupational injury benefits, paid sick leave, maternity and other social insurance). Estimates include both direct and indirect beneficiaries.",PER_SI_ALLSI.COV_POP_TOT,,1998-2019,{},6,0
106,Adequacy of unemployment benefits and ALMP (% of total welfare of beneficiary households),,% of total welfare of beneficiary households,%,"Adequacy of unemployment benefits and active labor market programs (ALMP) is measured by the total transfer amount received by the population participating in unemployment benefits and active labor market programs as a share of their total welfare. Welfare is defined as the total income or total expenditure of beneficiary households. Unemployment benefits and active labor market programs include unemployment compensation, severance pay, and early retirement due to labor market reasons, labor market services (intermediation), training (vocational, life skills, and cash for training), job rotation and job sharing, employment incentives and wage subsidies, supported employment and rehabilitation, and employment measures for the disabled. Estimates include both direct and indirect beneficiaries.",PER_LM_ALLLM.ADQ_POP_TOT,,2004-2018,{},6,0
119,"Adjusted net enrollment rate, primary (% of primary school age children)",,% of primary school age children,%,"Adjusted net enrollment is the number of pupils of the school-age group for primary education, enrolled either in primary or secondary education, expressed as a percentage of the total population in that age group.",SE.PRM.TENR,,1970-2019,{},57,0
120,"Adjusted net enrollment rate, primary, female (% of primary school age children)",,% of primary school age children,%,"Adjusted net enrollment is the number of pupils of the school-age group for primary education, enrolled either in primary or secondary education, expressed as a percentage of the total population in that age group.",SE.PRM.TENR.FE,,1970-2019,{},57,0
121,"Adjusted net enrollment rate, primary, male (% of primary school age children)",,% of primary school age children,%,"Adjusted net enrollment is the number of pupils of the school-age group for primary education, enrolled either in primary or secondary education, expressed as a percentage of the total population in that age group.",SE.PRM.TENR.MA,,1970-2019,{},57,0
122,Children out of school (% of primary school age),,% of primary school age,%,Children out of school are the percentage of primary-school-age children who are not enrolled in primary or secondary school. Children in the official primary age group that are in preprimary education should be considered out of school.,SE.PRM.UNER.ZS,,1970-2020,{},58,0
126,"Government expenditure on education, total (% of GDP)",,% of GDP,%,"General government expenditure on education (current, capital, and transfers) is expressed as a percentage of GDP. It includes expenditure funded by transfers from international sources to government. General government usually refers to local, regional and central governments.",SE.XPD.TOTL.GD.ZS,,1970-2019,{},58,0
125,"Government expenditure on education, total (% of government expenditure)",,% of government expenditure,%,"General government expenditure on education (current, capital, and transfers) is expressed as a percentage of total general government expenditure on all sectors (including health, education, social services, etc.). It includes expenditure funded by transfers from international sources to government. General government usually refers to local, regional and central governments.",SE.XPD.TOTL.GB.ZS,,1980-2019,{},58,0
111,"Literacy rate, adult female (% of females ages 15 and above)",,% of females ages 15 and above,%,Adult literacy rate is the percentage of people ages 15 and above who can both read and write with understanding a short simple statement about their everyday life.,SE.ADT.LITR.FE.ZS,,1970-2019,{},58,0
112,"Literacy rate, adult male (% of males ages 15 and above)",,% of males ages 15 and above,%,Adult literacy rate is the percentage of people ages 15 and above who can both read and write with understanding a short simple statement about their everyday life.,SE.ADT.LITR.MA.ZS,,1970-2019,{},58,0
113,"Literacy rate, adult total (% of people ages 15 and above)",,% of people ages 15 and above,%,Adult literacy rate is the percentage of people ages 15 and above who can both read and write with understanding a short simple statement about their everyday life.,SE.ADT.LITR.ZS,,1970-2019,{},58,0
110,"Literacy rate, youth (ages 15-24), gender parity index (GPI)",,GPI,GPI,Gender parity index for youth literacy rate is the ratio of females to males ages 15-24 who can both read and write with understanding a short simple statement about their everyday life.,SE.ADT.1524.LT.FM.ZS,,1970-2019,{},58,0
114,"Primary completion rate, female (% of relevant age group)",,% of relevant age group,%,"Primary completion rate, or gross intake ratio to the last grade of primary education, is the number of new entrants (enrollments minus repeaters) in the last grade of primary education, regardless of age, divided by the population at the entrance age for the last grade of primary education. Data limitations preclude adjusting for students who drop out during the final year of primary education.",SE.PRM.CMPT.FE.ZS,,1970-2020,{},58,0
115,"Primary completion rate, male (% of relevant age group)",,% of relevant age group,%,"Primary completion rate, or gross intake ratio to the last grade of primary education, is the number of new entrants (enrollments minus repeaters) in the last grade of primary education, regardless of age, divided by the population at the entrance age for the last grade of primary education. Data limitations preclude adjusting for students who drop out during the final year of primary education.",SE.PRM.CMPT.MA.ZS,,1970-2020,{},58,0
116,"Primary completion rate, total (% of relevant age group)",,% of relevant age group,%,"Primary completion rate, or gross intake ratio to the last grade of primary education, is the number of new entrants (enrollments minus repeaters) in the last grade of primary education, regardless of age, divided by the population at the entrance age for the last grade of primary education. Data limitations preclude adjusting for students who drop out during the final year of primary education.",SE.PRM.CMPT.ZS,,1970-2020,{},58,0
117,"Primary education, pupils (% female)",,% female,%,Female pupils as a percentage of total pupils at primary level include enrollments in public and private schools.,SE.PRM.ENRL.FE.ZS,,1970-2019,{},57,0
118,"School enrollment, primary (% net)",,% net,%,"Net enrollment rate is the ratio of children of official school age who are enrolled in school to the population of the corresponding official school age. Primary education provides children with basic reading, writing, and mathematics skills along with an elementary understanding of such subjects as history, geography, natural science, social science, art, and music.",SE.PRM.NENR,,1970-2019,{},57,0
123,"Secondary education, pupils (% female)",,% female,%,Female pupils as a percentage of total pupils at secondary level includes enrollments in public and private schools.,SE.SEC.ENRL.FE.ZS,,1970-2019,{},57,0
124,"Government expenditure per student, tertiary (% of GDP per capita)",,% of GDP per capita,%,"Government expenditure per student is the average general government expenditure (current, capital, and transfers) per student in the given level of education, expressed as a percentage of GDP per capita.",SE.XPD.TERT.PC.ZS,,1970-2018,{},57,0
128,Proportion of seats held by women in national parliaments (%),,%,%,Women in parliaments are the percentage of parliamentary seats in a single or lower chamber held by women.,SG.GEN.PARL.ZS,,1997-2020,{},34,0
127,"Women participating in the three decisions (own health care, major household purchases, and visiting family) (% of women age 15-49)",,% of women age 15-49,%,"Women participating in the three decisions (own health care, major household purchases, and visiting family) is the percentage of currently married women aged 15-49 who say that they alone or jointly have the final say in all of the three decisions (own health care, large purchases and visits to family, relatives, and friends).",SG.DMK.ALLD.FN.ZS,,1999-2018,{},13,0
129,Women who believe a husband is justified in beating his wife (any of five reasons) (%),,%,%,Percentage of women ages 15-49 who believe a husband/partner is justified in hitting or beating his wife/partner for any of the following five reasons: argues with him; refuses to have sex; burns the food; goes out without telling him; or when she neglects the children.,SG.VAW.REAS.ZS,,1999-2020,{},15,0
222,"Adolescent fertility rate (births per 1,000 women ages 15-19)",,"births per 1,000 women ages 15-19",births,"Adolescent fertility rate is the number of births per 1,000 women ages 15-19.",SP.ADO.TFRT,,1960-2019,{},72,0
238,Age dependency ratio (% of working-age population),,% of working-age population,%,Age dependency ratio is the ratio of dependents--people younger than 15 or older than 64--to the working-age population--those ages 15-64. Data are shown as the proportion of dependents per 100 working-age population.,SP.POP.DPND,,1960-2019,{},81,0
239,"Age dependency ratio, old (% of working-age population)",,% of working-age population,%,"Age dependency ratio, old, is the ratio of older dependents--people older than 64--to the working-age population--those ages 15-64. Data are shown as the proportion of dependents per 100 working-age population.",SP.POP.DPND.OL,,1960-2019,{},81,0
240,"Age dependency ratio, young (% of working-age population)",,% of working-age population,%,"Age dependency ratio, young, is the ratio of younger dependents--people younger than 15--to the working-age population--those ages 15-64. Data are shown as the proportion of dependents per 100 working-age population.",SP.POP.DPND.YG,,1960-2019,{},81,0
147,Antiretroviral therapy coverage (% of people living with HIV),,% of people living with HIV,%,Antiretroviral therapy coverage indicates the percentage of all people living with HIV who are receiving antiretroviral therapy.,SH.HIV.ARTC.ZS,,2000-2019,{},55,0
165,ARI treatment (% of children under 5 taken to a health provider),,% of children under 5 taken to a health provider,%,"Children with acute respiratory infection (ARI) who are taken to a health provider refers to the percentage of children under age five with ARI in the last two weeks who were taken to an appropriate health provider, including hospital, health center, dispensary, village health worker, clinic, and private physician.",SH.STA.ARIC.ZS,,1990-2020,{},61,0
223,"Birth rate, crude (per 1,000 people)",,"per 1,000 people",,"Crude birth rate indicates the number of live births occurring during the year, per 1,000 population estimated at midyear. Subtracting the crude death rate from the crude birth rate provides the rate of natural increase, which is equal to the rate of population change in the absence of migration.",SP.DYN.CBRT.IN,,1960-2019,{},1,0
167,Births attended by skilled health staff (% of total),,% of total,%,"Births attended by skilled health staff are the percentage of deliveries attended by personnel trained to give the necessary supervision, care, and advice to women during pregnancy, labor, and the postpartum period; to conduct deliveries on their own; and to care for newborns.",SH.STA.BRTC.ZS,,1980-2020,{},61,0
244,Completeness of birth registration (%),,%,%,Completeness of birth registration is the percentage of children under age 5 whose births were registered at the time of the survey. The numerator of completeness of birth registration includes children whose birth certificate was seen by the interviewer or whose mother or caretaker says the birth has been registered.,SP.REG.BRTH.ZS,,2000-2019,{},60,0
226,"Contraceptive prevalence, any methods (% of women ages 15-49)",,% of women ages 15-49,%,"Contraceptive prevalence rate is the percentage of women who are practicing, or whose sexual partners are practicing, any form of contraception. It is usually measured for women ages 15-49 who are married or in union.",SP.DYN.CONU.ZS,,1961-2020,{},59,0
225,"Contraceptive prevalence, modern methods (% of women ages 15-49)",,% of women ages 15-49,%,"Contraceptive prevalence rate is the percentage of women who are practicing, or whose sexual partners are practicing, at least one modern method of contraception. It is usually measured for women ages 15-49 who are married or in union. Modern methods of contraception include female and male sterilization, oral hormonal pills, the intra-uterine device (IUD), the male condom, injectables, the implant (including Norplant), vaginal barrier methods, the female condom and emergency contraception.",SP.DYN.CONM.ZS,,1961-2020,{},32,0
224,"Death rate, crude (per 1,000 people)",,"per 1,000 people",,"Crude death rate indicates the number of deaths occurring during the year, per 1,000 population estimated at midyear. Subtracting the crude death rate from the crude birth rate provides the rate of natural increase, which is equal to the rate of population change in the absence of migration.",SP.DYN.CDRT.IN,,1960-2019,{},2,0
143,Demand for family planning satisfied by modern methods (% of married women with demand for family planning),,% of married women with demand for family planning,%,Demand for family planning satisfied by modern methods refers to the percentage of married women ages 15-49 years whose need for family planning is satisfied with modern methods.,SH.FPL.SATM.ZS,,1984-2019,{},17,0
168,Diabetes prevalence (% of population ages 20 to 79),,% of population ages 20 to 79,%,Diabetes prevalence refers to the percentage of people ages 20-79 who have type 1 or type 2 diabetes. It is calculated by adjusting to a standard population age-structure.,SH.STA.DIAB.ZS,,2010-2019,{},38,0
177,Diarrhea treatment (% of children under 5 who received ORS packet),,% of children under 5 who received ORS packet,%,Percentage of children under age 5 with diarrhea in the two weeks preceding the survey who received oral rehydration salts (ORS packets or pre-packaged ORS fluids).,SH.STA.ORTH,,1985-2020,{},61,0
166,Exclusive breastfeeding (% of children under 6 months),,% of children under 6 months,%,Exclusive breastfeeding refers to the percentage of children less than six months old who are fed breast milk alone (no other liquids) in the past 24 hours.,SH.STA.BFED.ZS,,1986-2018,{},61,0
231,"Fertility rate, total (births per woman)",,births per woman,births,Total fertility rate represents the number of children that would be born to a woman if she were to live to the end of her childbearing years and bear children in accordance with age-specific fertility rates of the specified year.,SP.DYN.TFRT.IN,,1960-2019,{},3,0
151,"Hospital beds (per 1,000 people)",,"per 1,000 people",,"Hospital beds include inpatient beds available in public, private, general, and specialized hospitals and rehabilitation centers. In most cases beds for both acute and chronic care are included.",SH.MED.BEDS.ZS,,1960-2019,{},11,0
230,"Life expectancy at birth, total (years)",,years,years,Life expectancy at birth indicates the number of years a newborn infant would live if prevailing patterns of mortality at the time of its birth were to stay the same throughout its life.,SP.DYN.LE00.IN,,1960-2019,{},0,0
160,Lifetime risk of maternal death (%),,%,%,"Life time risk of maternal death is the probability that a 15-year-old female will die eventually from a maternal cause assuming that current levels of fertility and mortality (including maternal mortality) do not change in the future, taking into account competing causes of death.",SH.MMR.RISK.ZS,,2000-2017,{},75,0
173,"Maternal mortality ratio (modeled estimate, per 100,000 live births)",,"modeled estimate, per 100,000 live births","modeled estimate,","Maternal mortality ratio is the number of women who die from pregnancy-related causes while pregnant or within 42 days of pregnancy termination per 100,000 live births. The data are estimated with a regression model using information on the proportion of maternal deaths among non-AIDS deaths in women ages 15-49, fertility, birth attendants, and GDP measured using purchasing power parities (PPPs).",SH.STA.MMRT,,2000-2017,{},75,0
141,"Mortality from CVD, cancer, diabetes or CRD between exact ages 30 and 70 (%)",,%,%,"Mortality from CVD, cancer, diabetes or CRD is the percent of 30-year-old-people who would die before their 70th birthday from any of cardiovascular disease, cancer, diabetes,  or chronic respiratory disease, assuming that s/he would experience current mortality rates at every age and s/he would not die from any other cause of death (e.g., injuries or HIV/AIDS).",SH.DYN.NCOM.ZS,,2000-2019,{},101,0
228,"Mortality rate, infant (per 1,000 live births)",,"per 1,000 live births",,"Infant mortality rate is the number of infants dying before reaching one year of age, per 1,000 live births in a given year.",SP.DYN.IMRT.IN,,1960-2019,{},24,0
227,"Mortality rate, infant, female (per 1,000 live births)",,"per 1,000 live births",,"Infant mortality rate, female is the number of female infants dying before reaching one year of age, per 1,000 female live births in a given year.",SP.DYN.IMRT.FE.IN,,1960-2019,{},24,0
229,"Mortality rate, infant, male (per 1,000 live births)",,"per 1,000 live births",,"Infant mortality rate, male is the number of male infants dying before reaching one year of age, per 1,000 male live births in a given year.",SP.DYN.IMRT.MA.IN,,1960-2019,{},24,0
142,"Mortality rate, neonatal (per 1,000 live births)",,"per 1,000 live births",,"Neonatal mortality rate is the number of neonates dying before reaching 28 days of age, per 1,000 live births in a given year.",SH.DYN.NMRT,,1960-2019,{},24,0
138,"Mortality rate, under-5 (per 1,000 live births)",,"per 1,000 live births",,"Under-five mortality rate is the probability per 1,000 that a newborn baby will die before reaching age five, if subject to age-specific mortality rates of the specified year.",SH.DYN.MORT,,1960-2019,"{""name"": ""Child mortality"", ""unit"": ""%"", ""shortUnit"": ""%"", ""tolerance"": 5, ""isProjection"": false, ""conversionFactor"": 0.1}",24,0
139,"Mortality rate, under-5, female (per 1,000 live births)",,"per 1,000 live births",,"Under-five mortality rate, female is the probability per 1,000 that a newborn female baby will die before reaching age five, if subject to female age-specific mortality rates of the specified year.",SH.DYN.MORT.FE,,1960-2019,{},24,0
140,"Mortality rate, under-5, male (per 1,000 live births)",,"per 1,000 live births",,"Under-five mortality rate, male is the probability per 1,000 that a newborn male baby will die before reaching age five, if subject to male age-specific mortality rates of the specified year.",SH.DYN.MORT.MA,,1960-2019,"{""name"": ""Child mortality rate of boys"", ""unit"": ""%"", ""tolerance"": 5, ""conversionFactor"": 0.1}",24,0
159,Number of maternal deaths,,,,"A maternal death refers to the death of a woman while pregnant or within 42 days of termination of pregnancy, irrespective of the duration and site of the pregnancy, from any cause related to or aggravated by the pregnancy or its management but not from accidental or incidental causes.",SH.MMR.DTHS,,2000-2017,"{""unit"": ""maternal deaths"", ""numDecimalPlaces"": 0}",75,0
153,"Nurses and midwives (per 1,000 people)",,"per 1,000 people",,"Nurses and midwives include professional nurses, professional midwives, auxiliary nurses, auxiliary midwives, enrolled nurses, enrolled midwives and other associated personnel, such as dental nurses and primary care nurses.",SH.MED.NUMW.P3,,1990-2018,{},100,0
