id,name,original_metadata,unit,short_unit,description,code,coverage,timespan,display,source_id,dataset_id
27,Access to electricity (% of population),,% of population,%,"Access to electricity is the percentage of population with access to electricity. Electrification data are collected from industry, national surveys and international sources.",EG.ELC.ACCS.ZS,,1990-2019,"{""unit"": ""Not applicable""}",97,0
25,"Access to electricity, rural (% of rural population)",,% of rural population,%,"Access to electricity, rural is the percentage of rural population with access to electricity.",EG.ELC.ACCS.RU.ZS,,1990-2019,"{""unit"": ""Not applicable""}",97,0
26,"Access to electricity, urban (% of urban population)",,% of urban population,%,"Access to electricity, urban is the percentage of urban population with access to electricity.",EG.ELC.ACCS.UR.ZS,,1990-2019,"{""unit"": ""Percent""}",97,0
1,Agricultural land (% of land area),,% of land area,%,"Agricultural land refers to the share of land area that is arable, under permanent crops, and under permanent pastures. Arable land includes land defined by the FAO as land under temporary crops (double-cropped areas are counted once), temporary meadows for mowing or for pasture, land under market or kitchen gardens, and land temporarily fallow. Land abandoned as a result of shifting cultivation is excluded. Land under permanent crops is land cultivated with crops that occupy the land for long periods and need not be replanted after each harvest, such as cocoa, coffee, and rubber. This category includes land under flowering shrubs, fruit trees, nut trees, and vines, but excludes land under trees grown for wood or timber. Permanent pasture is land used for five or more years for forage, including natural and cultivated crops.",AG.LND.AGRI.ZS,,1961-2018,"{""unit"": ""Number""}",28,0
10,"Agricultural machinery, tractors per 100 sq. km of arable land",,,,"Agricultural machinery refers to the number of wheel and crawler tractors (excluding garden tractors) in use in agriculture at the end of the calendar year specified or during the first quarter of the following year. Arable land includes land defined by the FAO as land under temporary crops (double-cropped areas are counted once), temporary meadows for mowing or for pasture, land under market or kitchen gardens, and land temporarily fallow. Land abandoned as a result of shifting cultivation is excluded.",AG.LND.TRAC.ZS,,1961-2009,"{""unit"": ""Number""}",28,0
52,"Annual freshwater withdrawals, agriculture (% of total freshwater withdrawal)",,% of total freshwater withdrawal,%,"Annual freshwater withdrawals refer to total water withdrawals, not counting evaporation losses from storage basins. Withdrawals also include water from desalination plants in countries where they are a significant source. Withdrawals can exceed 100 percent of total renewable resources where extraction from nonrenewable aquifers or desalination plants is considerable or where there is significant water reuse. Withdrawals for agriculture are total withdrawals for irrigation and livestock production. Data are for the most recent year available for 1987-2002.",ER.H2O.FWAG.ZS,,1965-2017,"{""unit"": ""Percent""}",27,0
53,"Annual freshwater withdrawals, domestic (% of total freshwater withdrawal)",,% of total freshwater withdrawal,%,"Annual freshwater withdrawals refer to total water withdrawals, not counting evaporation losses from storage basins. Withdrawals also include water from desalination plants in countries where they are a significant source. Withdrawals can exceed 100 percent of total renewable resources where extraction from nonrenewable aquifers or desalination plants is considerable or where there is significant water reuse. Withdrawals for domestic uses include drinking water, municipal use or supply, and use for public services, commercial establishments, and homes. Data are for the most recent year available for 1987-2002.",ER.H2O.FWDM.ZS,,1965-2017,"{""unit"": ""Local currency""}",27,0
54,"Annual freshwater withdrawals, industry (% of total freshwater withdrawal)",,% of total freshwater withdrawal,%,"Annual freshwater withdrawals refer to total water withdrawals, not counting evaporation losses from storage basins. Withdrawals also include water from desalination plants in countries where they are a significant source. Withdrawals can exceed 100 percent of total renewable resources where extraction from nonrenewable aquifers or desalination plants is considerable or where there is significant water reuse. Withdrawals for industry are total withdrawals for direct industrial use (including withdrawals for cooling thermoelectric plants). Data are for the most recent year available for 1987-2002.",ER.H2O.FWIN.ZS,,1965-2017,"{""unit"": ""Percent""}",27,0
56,"Annual freshwater withdrawals, total (% of internal resources)",,% of internal resources,%,"Annual freshwater withdrawals refer to total water withdrawals, not counting evaporation losses from storage basins. Withdrawals also include water from desalination plants in countries where they are a significant source. Withdrawals can exceed 100 percent of total renewable resources where extraction from nonrenewable aquifers or desalination plants is considerable or where there is significant water reuse. Withdrawals for agriculture and industry are total withdrawals for irrigation and livestock production and for direct industrial use (including withdrawals for cooling thermoelectric plants). Withdrawals for domestic uses include drinking water, municipal use or supply, and use for public services, commercial establishments, and homes. Data are for the most recent year available for 1987-2002.",ER.H2O.FWTL.ZS,,1962-2017,"{""unit"": ""Number""}",27,0
55,"Annual freshwater withdrawals, total (billion cubic meters)",,billion cubic meters,,"Annual freshwater withdrawals refer to total water withdrawals, not counting evaporation losses from storage basins. Withdrawals also include water from desalination plants in countries where they are a significant source. Withdrawals can exceed 100 percent of total renewable resources where extraction from nonrenewable aquifers or desalination plants is considerable or where there is significant water reuse. Withdrawals for agriculture and industry are total withdrawals for irrigation and livestock production and for direct industrial use (including withdrawals for cooling thermoelectric plants). Withdrawals for domestic uses include drinking water, municipal use or supply, and use for public services, commercial establishments, and homes. Data are for the most recent year available for 1987-2002.",ER.H2O.FWTL.K3,,1962-2017,"{""unit"": ""Percent""}",27,0
48,Aquaculture production (metric tons),,metric tons,,"Aquaculture is understood to mean the farming of aquatic organisms including fish, molluscs, crustaceans and aquatic plants. Aquaculture production specifically refers to output from aquaculture activities, which are designated for final harvest for consumption.",ER.FSH.AQUA.MT,,1960-2018,{},29,0
4,Arable land (% of land area),,% of land area,%,"Arable land includes land defined by the FAO as land under temporary crops (double-cropped areas are counted once), temporary meadows for mowing or for pasture, land under market or kitchen gardens, and land temporarily fallow. Land abandoned as a result of shifting cultivation is excluded.",AG.LND.ARBL.ZS,,1961-2018,"{""unit"": ""Percent""}",28,0
3,Arable land (hectares per person),,hectares per person,hectares,"Arable land (hectares per person) includes land defined by the FAO as land under temporary crops (double-cropped areas are counted once), temporary meadows for mowing or for pasture, land under market or kitchen gardens, and land temporarily fallow. Land abandoned as a result of shifting cultivation is excluded.",AG.LND.ARBL.HA.PC,,1961-2018,"{""unit"": ""Percent""}",28,0
49,Capture fisheries production (metric tons),,metric tons,,"Capture fisheries production measures the volume of fish catches landed by a country for all commercial, industrial, recreational and subsistence purposes.",ER.FSH.CAPT.MT,,1960-2018,"{""unit"": ""Percent""}",29,0
11,Cereal yield (kg per hectare),,kg per hectare,kg,"Cereal yield, measured as kilograms per hectare of harvested land, includes wheat, rice, maize, barley, oats, rye, millet, sorghum, buckwheat, and mixed grains. Production data on cereals relate to crops harvested for dry grain only. Cereal crops harvested for hay or harvested green for food, feed, or silage and those used for grazing are excluded. The FAO allocates production data to the calendar year in which the bulk of the harvest took place. Most of a crop harvested near the end of a year will be used in the following year.",AG.YLD.CREL.KG,,1961-2018,"{""unit"": ""Percent""}",28,0
30,CO2 emissions (kt),,kt,kt,"Carbon dioxide emissions are those stemming from the burning of fossil fuels and the manufacture of cement. They include carbon dioxide produced during consumption of solid, liquid, and gas fuels and gas flaring.",EN.ATM.CO2E.KT,,1960-2016,"{""unit"": ""Percent""}",8,0
31,CO2 emissions (metric tons per capita),,metric tons per capita,metric tons,"Carbon dioxide emissions are those stemming from the burning of fossil fuels and the manufacture of cement. They include carbon dioxide produced during consumption of solid, liquid, and gas fuels and gas flaring.",EN.ATM.CO2E.PC,,1960-2016,"{""unit"": ""Kilometres""}",8,0
24,Energy intensity level of primary energy (MJ/$2011 PPP GDP),,MJ/$2011 PPP GDP,$,Energy intensity level of primary energy is the ratio between energy supply and gross domestic product measured at purchasing power parity. Energy intensity is an indication of how much energy is used to produce one unit of economic output. Lower ratio indicates that less energy is used to produce one unit of output.,EG.EGY.PRIM.PP.KD,,1990-2015,"{""unit"": ""Rate""}",97,0
29,Energy use (kg of oil equivalent per capita),,kg of oil equivalent per capita,kg of oil equivalent,"Energy use refers to use of primary energy before transformation to other end-use fuels, which is equal to indigenous production plus imports and stock changes, minus exports and fuels supplied to ships and aircraft engaged in international transport.",EG.USE.PCAP.KG.OE,,1960-2015,"{""unit"": ""Rate""}",33,0
0,Fertilizer consumption (kilograms per hectare of arable land),,kilograms per hectare of arable land,kilograms,"Fertilizer consumption measures the quantity of plant nutrients used per unit of arable land. Fertilizer products cover nitrogenous, potash, and phosphate fertilizers (including ground rock phosphate). Traditional nutrients--animal and plant manures--are not included. For the purpose of data dissemination, FAO has adopted the concept of a calendar year (January to December). Some countries compile fertilizer data on a calendar year basis, while others are on a split-year basis. Arable land includes land defined by the FAO as land under temporary crops (double-cropped areas are counted once), temporary meadows for mowing or for pasture, land under market or kitchen gardens, and land temporarily fallow. Land abandoned as a result of shifting cultivation is excluded.",AG.CON.FERT.ZS,,1961-2018,"{""unit"": ""Rate""}",28,0
8,Land area (sq. km),,sq. km,sq. km,"Land area is a country's total area, excluding area under inland water bodies, national claims to continental shelf, and exclusive economic zones. In most cases the definition of inland water bodies includes major rivers and lakes.",AG.LND.TOTL.K2,,1961-2018,"{""unit"": ""Rate""}",28,0
59,Marine protected areas (% of territorial waters),,% of territorial waters,%,Marine protected areas are areas of intertidal or subtidal terrain--and overlying water and associated flora and fauna and historical and cultural features--that have been reserved by law or other effective means to protect part or all of the enclosed environment.,ER.MRN.PTMR.ZS,,2016-2018,"{""unit"": ""Rate""}",99,0
32,"PM2.5 air pollution, mean annual exposure (micrograms per cubic meter)",,micrograms per cubic meter,micrograms,"Population-weighted exposure to ambient PM2.5 pollution is defined as the average level of exposure of a nation's population to concentrations of suspended particles measuring less than 2.5 microns in aerodynamic diameter, which are capable of penetrating deep into the respiratory tract and causing severe health damage. Exposure is calculated by weighting mean annual concentrations of PM2.5 by population in both urban and rural areas.",EN.ATM.PM25.MC.M3,,1990-2017,"{""unit"": ""Rate""}",7,0
36,"PM2.5 air pollution, population exposed to levels exceeding WHO guideline value (% of total)",,% of total,%,"Percent of population exposed to ambient concentrations of PM2.5 that exceed the WHO guideline value is defined as the portion of a country’s population living in places where mean annual concentrations of PM2.5 are greater than 10 micrograms per cubic meter, the guideline value recommended by the World Health Organization as the lower end of the range of concentrations over which adverse health effects due to PM2.5 exposure have been observed.",EN.ATM.PM25.MC.ZS,,1990-2017,"{""unit"": ""Rate""}",7,0
41,Population density (people per sq. km of land area),,people per sq. km of land area,people,"Population density is midyear population divided by land area in square kilometers. Population is based on the de facto definition of population, which counts all residents regardless of legal status or citizenship--except for refugees not permanently settled in the country of asylum, who are generally considered part of the population of their country of origin. Land area is a country's total area, excluding area under inland water bodies, national claims to continental shelf, and exclusive economic zones. In most cases the definition of inland water bodies includes major rivers and lakes.",EN.POP.DNST,,1961-2019,"{""unit"": ""Rate""}",25,0
43,Population in the largest city (% of urban population),,% of urban population,%,Population in largest city is the percentage of a country's urban population living in that country's largest metropolitan area.,EN.URB.LCTY.UR.ZS,,1960-2019,"{""unit"": ""Rate""}",74,0
45,Population in urban agglomerations of more than 1 million (% of total population),,% of total population,%,Population in urban agglomerations of more than one million is the percentage of a country's population living in metropolitan areas that in 2018 had a population of more than one million people.,EN.URB.MCTY.TL.ZS,,1960-2019,"{""unit"": ""Rate""}",74,0
42,Population living in slums (% of urban population),,% of urban population,%,"Population living in slums is the proportion of the urban population living in slum households. A slum household is defined as a group of individuals living under the same roof lacking one or more of the following conditions: access to improved water, access to improved sanitation, sufficient living area, housing durability, and security of tenure, as adopted in the Millennium Development Goal Target 7.D. The successor, the Sustainable Development Goal 11.1.1, considers inadequate housing (housing affordability) to complement the above definition of slums/informal settlements.",EN.POP.SLUM.UR.ZS,,1990-2018,"{""unit"": ""Rate""}",69,0
28,Renewable energy consumption (% of total final energy consumption),,% of total final energy consumption,%,Renewable energy consumption is the share of renewables energy in total final energy consumption.,EG.FEC.RNEW.ZS,,1990-2015,"{""unit"": ""Rate""}",97,0
57,Renewable internal freshwater resources per capita (cubic meters),,cubic meters,,Renewable internal freshwater resources flows refer to internal renewable resources (internal river flows and groundwater from rainfall) in the country. Renewable internal freshwater resources per capita are calculated using the World Bank's population estimates.,ER.H2O.INTR.PC,,1962-2017,"{""unit"": ""Rate""}",27,0
5,Rural land area where elevation is below 5 meters (% of total land area),,% of total land area,%,Rural land area below 5m is the percentage of total land where the rural land elevation is 5 meters or less.,AG.LND.EL5M.RU.ZS,,1990-2010,"{""unit"": ""Rate""}",9,0
245,Rural population,,,,Rural population refers to people living in rural areas as defined by national statistical offices. It is calculated as the difference between total population and urban population. Aggregation of urban and rural population may not add up to total population because of different country coverages.,SP.RUR.TOTL,,1960-2019,"{""unit"": ""Rate""}",83,0
58,Terrestrial protected areas (% of total land area),,% of total land area,%,"Terrestrial protected areas are totally or partially protected areas of at least 1,000 hectares that are designated by national authorities as scientific reserves with limited public access, national parks, natural monuments, nature reserves or wildlife sanctuaries, protected landscapes, and areas managed mainly for sustainable use. Marine areas, unclassified areas, littoral (intertidal) areas, and sites protected under local or provincial law are excluded.",ER.LND.PTLD.ZS,,2016-2018,"{""unit"": ""Rate""}",98,0
50,Total fisheries production (metric tons),,metric tons,,"Total fisheries production measures the volume of aquatic species caught by a country for all commercial, industrial, recreational and subsistence purposes. The harvest from mariculture, aquaculture and other kinds of fish farming is also included.",ER.FSH.PROD.MT,,1960-2018,"{""unit"": ""Rate""}",29,0
102,Total natural resources rents (% of GDP),,% of GDP,%,"Total natural resources rents are the sum of oil rents, natural gas rents, coal rents (hard and soft), mineral rents, and forest rents.",NY.GDP.TOTL.RT.ZS,,1970-2019,"{""unit"": ""Rate""}",82,0
9,Urban land area (sq. km),,sq. km,sq. km,"Urban land area in square kilometers, based on a combination of population counts (persons), settlement points, and the presence of Nighttime Lights. Areas are defined as urban where contiguous lighted cells from the Nighttime Lights or approximated urban extents based on buffered settlement points for which the total population is greater than 5,000 persons.",AG.LND.TOTL.UR.K2,,1990-2010,"{""unit"": ""Rate""}",10,0
246,Urban population,,,,Urban population refers to people living in urban areas as defined by national statistical offices. It is calculated using World Bank population estimates and urban ratios from the United Nations World Urbanization Prospects. Aggregation of urban and rural population may not add up to total population because of different country coverages.,SP.URB.TOTL,,1960-2019,"{""unit"": ""Number""}",83,0
51,"Water productivity, total (constant 2010 US$ GDP per cubic meter of total freshwater withdrawal)",,constant 2010 US$ GDP per cubic meter of total freshwater withdrawal,$,Water productivity is calculated as GDP in constant prices divided by annual total water withdrawal.,ER.GDP.FWTL.M3.KD,,1967-2017,"{""unit"": ""Rate""}",26,0
6,Agricultural irrigated land (% of total agricultural land),,% of total agricultural land,%,"Agricultural irrigated land refers to agricultural areas purposely provided with water, including land irrigated by controlled flooding.",AG.LND.IRIG.AG.ZS,,2001-2018,"{""unit"": ""Rate""}",28,0
2,Arable land (hectares),,hectares,hectares,"Arable land (in hectares) includes land defined by the FAO as land under temporary crops (double-cropped areas are counted once), temporary meadows for mowing or for pasture, land under market or kitchen gardens, and land temporarily fallow. Land abandoned as a result of shifting cultivation is excluded.",AG.LND.ARBL.HA,,1961-2018,"{""unit"": ""Rate""}",28,0
7,Average precipitation in depth (mm per year),,mm per year,mm,Average precipitation is the long-term average in depth (over space and time) of annual precipitation in the country. Precipitation is defined as any kind of water that falls from clouds as a liquid or a solid.,AG.LND.PRCP.MM,,1962-2017,"{""unit"": ""Rate""}",28,0
44,Population in urban agglomerations of more than 1 million,,,,Population in urban agglomerations of more than one million is the country's population living in metropolitan areas that in 2018 had a population of more than one million people.,EN.URB.MCTY,,1960-2019,"{""unit"": ""Rate""}",74,0
38,Disaster risk reduction progress score (1-5 scale; 5=best),,1-5 scale; 5=best,,"Disaster risk reduction progress score is an average of self-assessment scores, ranging from 1 to 5, submitted by countries under Priority 1 of the Hyogo Framework National Progress Reports. The Hyogo Framework is a global blueprint for disaster risk reduction efforts that was adopted by 168 countries in 2005. Assessments of ""Priority 1"" include four indicators that reflect the degree to which countries have prioritized disaster risk reduction and the strengthening of relevant institutions.",EN.CLC.DRSK.XQ,,2011-2011,"{""unit"": ""Rate""}",5,0
37,"Bird species, threatened",,,,"Birds are listed for countries included within their breeding or wintering ranges. Threatened species are the number of species classified by the IUCN as endangered, vulnerable, rare, indeterminate, out of danger, or insufficiently known.",EN.BIR.THRD.NO,,2017-2018,{},66,0
39,"Fish species, threatened",,,,"Fish species are based on Froese, R. and Pauly, D. (eds). 2008. Threatened species are the number of species classified by the IUCN as endangered, vulnerable, rare, indeterminate, out of danger, or insufficiently known.",EN.FSH.THRD.NO,,2017-2018,{},30,0
40,"Mammal species, threatened",,,,"Mammal species are mammals excluding whales and porpoises. Threatened species are the number of species classified by the IUCN as endangered, vulnerable, rare, indeterminate, out of danger, or insufficiently known.",EN.MAM.THRD.NO,,2017-2018,{},66,0
33,"PM2.5 pollution, population exposed to levels exceeding WHO Interim Target-1 value (% of total)",,% of total,%,Percent of population exposed to ambient concentrations of PM2.5 that exceed the World Health Organization (WHO) Interim Target 1 (IT-1) is defined as the portion of a country’s population living in places where mean annual concentrations of PM2.5 are greater than 35 micrograms per cubic meter. The Air Quality Guideline (AQG) of 10 micrograms per cubic meter is recommended by the WHO as the lower end of the range of concentrations over which adverse health effects due to PM2.5 exposure have been observed.,EN.ATM.PM25.MC.T1.ZS,,1990-2017,{},7,0
34,"PM2.5 pollution, population exposed to levels exceeding WHO Interim Target-2 value (% of total)",,% of total,%,Percent of population exposed to ambient concentrations of PM2.5 that exceed the World Health Organization (WHO) Interim Target 2 (IT-2) is defined as the portion of a country’s population living in places where mean annual concentrations of PM2.5 are greater than 25 micrograms per cubic meter. The Air Quality Guideline (AQG) of 10 micrograms per cubic meter is recommended by the WHO as the lower end of the range of concentrations over which adverse health effects due to PM2.5 exposure have been observed.,EN.ATM.PM25.MC.T2.ZS,,1990-2017,{},7,0
35,"PM2.5 pollution, population exposed to levels exceeding WHO Interim Target-3 value (% of total)",,% of total,%,Percent of population exposed to ambient concentrations of PM2.5 that exceed the World Health Organization (WHO) Interim Target 3 (IT-3) is defined as the portion of a country’s population living in places where mean annual concentrations of PM2.5 are greater than 15 micrograms per cubic meter. The Air Quality Guideline (AQG) of 10 micrograms per cubic meter is recommended by the WHO as the lower end of the range of concentrations over which adverse health effects due to PM2.5 exposure have been observed.,EN.ATM.PM25.MC.T3.ZS,,1990-2017,{},7,0
90,Exports of goods and services (% of GDP),,% of GDP,%,"Exports of goods and services represent the value of all goods and other market services provided to the rest of the world. They include the value of merchandise, freight, insurance, transport, travel, royalties, license fees, and other services, such as communication, construction, financial, information, business, personal, and government services. They exclude compensation of employees and investment income (formerly called factor services) and transfer payments.",NE.EXP.GNFS.ZS,,1960-2019,"{""unit"": ""Rate""}",78,0
89,Exports of goods and services (constant 2010 US$),,constant 2010 US$,$,"Exports of goods and services represent the value of all goods and other market services provided to the rest of the world. They include the value of merchandise, freight, insurance, transport, travel, royalties, license fees, and other services, such as communication, construction, financial, information, business, personal, and government services. They exclude compensation of employees and investment income (formerly called factor services) and transfer payments. Data are in constant 2010 U.S. dollars.",NE.EXP.GNFS.KD,,1960-2019,"{""unit"": ""Rate""}",78,0
88,Exports of goods and services (current US$),,current US$,$,"Exports of goods and services represent the value of all goods and other market services provided to the rest of the world. They include the value of merchandise, freight, insurance, transport, travel, royalties, license fees, and other services, such as communication, construction, financial, information, business, personal, and government services. They exclude compensation of employees and investment income (formerly called factor services) and transfer payments. Data are in current U.S. dollars.",NE.EXP.GNFS.CD,,1960-2019,"{""unit"": ""Rate""}",78,0
