id,name,original_metadata,unit,short_unit,description,code,coverage,timespan,display,source_id,dataset_id
17,"Foreign direct investment, net inflows (% of GDP)",,% of GDP,%,"Foreign direct investment are the net inflows of investment to acquire a lasting management interest (10 percent or more of voting stock) in an enterprise operating in an economy other than that of the investor. It is the sum of equity capital, reinvestment of earnings, other long-term capital, and short-term capital as shown in the balance of payments. This series shows net inflows (new investment inflows less disinvestment) in the reporting economy from foreign investors, and is divided by GDP.",BX.KLT.DINV.WD.GD.ZS,,1970-2019,"{""unit"": ""Rate""}",47,0
13,"Foreign direct investment, net outflows (% of GDP)",,% of GDP,%,"Foreign direct investment refers to direct investment equity flows in an economy. It is the sum of equity capital, reinvestment of earnings, and other capital. Direct investment is a category of cross-border investment associated with a resident in one economy having control or a significant degree of influence on the management of an enterprise that is resident in another economy. Ownership of 10 percent or more of the ordinary shares of voting stock is the criterion for determining the existence of a direct investment relationship. This series shows net outflows of investment from the reporting economy to the rest of the world, and is divided by GDP.",BM.KLT.DINV.WD.GD.ZS,,1970-2019,"{""unit"": ""Rate""}",43,0
96,GDP (constant 2010 US$),,constant 2010 US$,$,"GDP at purchaser's prices is the sum of gross value added by all resident producers in the economy plus any product taxes and minus any subsidies not included in the value of the products. It is calculated without making deductions for depreciation of fabricated assets or for depletion and degradation of natural resources. Data are in constant 2010 U.S. dollars. Dollar figures for GDP are converted from domestic currencies using 2010 official exchange rates. For a few countries where the official exchange rate does not reflect the rate effectively applied to actual foreign exchange transactions, an alternative conversion factor is used.",NY.GDP.MKTP.KD,,1960-2019,"{""unit"": ""Rate""}",78,0
97,GDP growth (annual %),,annual %,%,Annual percentage growth rate of GDP at market prices based on constant local currency. Aggregates are based on constant 2010 U.S. dollars. GDP is the sum of gross value added by all resident producers in the economy plus any product taxes and minus any subsidies not included in the value of the products. It is calculated without making deductions for depreciation of fabricated assets or for depletion and degradation of natural resources.,NY.GDP.MKTP.KD.ZG,,1961-2019,"{""unit"": ""Rate""}",78,0
99,GDP per capita (constant 2010 US$),,constant 2010 US$,$,GDP per capita is gross domestic product divided by midyear population. GDP is the sum of gross value added by all resident producers in the economy plus any product taxes and minus any subsidies not included in the value of the products. It is calculated without making deductions for depreciation of fabricated assets or for depletion and degradation of natural resources. Data are in constant 2010 U.S. dollars.,NY.GDP.PCAP.KD,,1960-2019,"{""unit"": ""Rate""}",78,0
98,GDP per capita (current US$),,current US$,$,GDP per capita is gross domestic product divided by midyear population. GDP is the sum of gross value added by all resident producers in the economy plus any product taxes and minus any subsidies not included in the value of the products. It is calculated without making deductions for depreciation of fabricated assets or for depletion and degradation of natural resources. Data are in current U.S. dollars.,NY.GDP.PCAP.CD,,1960-2019,"{""unit"": ""Rate""}",78,0
100,GDP per capita growth (annual %),,annual %,%,Annual percentage growth rate of GDP per capita based on constant local currency. Aggregates are based on constant 2010 U.S. dollars. GDP per capita is gross domestic product divided by midyear population. GDP at purchaser's prices is the sum of gross value added by all resident producers in the economy plus any product taxes and minus any subsidies not included in the value of the products. It is calculated without making deductions for depreciation of fabricated assets or for depletion and degradation of natural resources.,NY.GDP.PCAP.KD.ZG,,1961-2019,"{""unit"": ""Rate""}",78,0
101,"GDP per capita, PPP (current international $)",,current international $,$,"This indicator provides per capita values for gross domestic product (GDP) expressed in current international dollars converted by purchasing power parity (PPP) conversion factor. 

GDP is the sum of gross value added by all resident producers in the country plus any product taxes and minus any subsidies not included in the value of the products. conversion factor is a spatial price deflator and currency converter that controls for price level differences between countries. Total population is a mid-year population based on the de facto definition of population, which counts all residents regardless of legal status or citizenship.",NY.GDP.PCAP.PP.CD,,1990-2019,"{""name"": ""GDP per capita"", ""unit"": ""Rate""}",37,0
87,General government final consumption expenditure (constant 2010 US$),,constant 2010 US$,$,"General government final consumption expenditure (formerly general government consumption) includes all government current expenditures for purchases of goods and services (including compensation of employees). It also includes most expenditures on national defense and security, but excludes government military expenditures that are part of government capital formation. Data are in constant 2010 U.S. dollars.",NE.CON.GOVT.KD,,1960-2019,"{""unit"": ""Rate""}",78,0
15,"Goods exports (BoP, current US$)",,"BoP, current US$",$,Goods exports refer to all movable goods (including nonmonetary gold and net exports of goods under merchanting) involved in a change of ownership from residents to nonresidents. Data are in current U.S. dollars.,BX.GSR.MRCH.CD,,1960-2019,"{""unit"": ""Rate""}",42,0
103,Gross domestic savings (% of GDP),,% of GDP,%,Gross domestic savings are calculated as GDP less final consumption expenditure (total consumption).,NY.GDS.TOTL.ZS,,1960-2019,"{""unit"": ""Rate""}",78,0
92,Imports of goods and services (constant 2010 US$),,constant 2010 US$,$,"Imports of goods and services represent the value of all goods and other market services received from the rest of the world. They include the value of merchandise, freight, insurance, transport, travel, royalties, license fees, and other services, such as communication, construction, financial, information, business, personal, and government services. They exclude compensation of employees and investment income (formerly called factor services) and transfer payments. Data are in constant 2010 U.S. dollars.",NE.IMP.GNFS.KD,,1960-2019,"{""unit"": ""Rate""}",78,0
91,Imports of goods and services (current US$),,current US$,$,"Imports of goods and services represent the value of all goods and other market services received from the rest of the world. They include the value of merchandise, freight, insurance, transport, travel, royalties, license fees, and other services, such as communication, construction, financial, information, business, personal, and government services. They exclude compensation of employees and investment income (formerly called factor services) and transfer payments. Data are in current U.S. dollars.",NE.IMP.GNFS.CD,,1960-2019,"{""unit"": ""Rate""}",78,0
21,Net ODA received per capita (current US$),,current US$,$,"Net official development assistance (ODA) per capita consists of disbursements of loans made on concessional terms (net of repayments of principal) and grants by official agencies of the members of the Development Assistance Committee (DAC), by multilateral institutions, and by non-DAC countries to promote economic development and welfare in countries and territories in the DAC list of ODA recipients; and is calculated by dividing net ODA received by the midyear population estimate. It includes loans with a grant element of at least 25 percent (calculated at a rate of discount of 10 percent).",DT.ODA.ODAT.PC.ZS,,1960-2019,"{""unit"": ""Rate""}",23,0
20,Net official development assistance and official aid received (current US$),,current US$,$,"Net official development assistance (ODA) consists of disbursements of loans made on concessional terms (net of repayments of principal) and grants by official agencies of the members of the Development Assistance Committee (DAC), by multilateral institutions, and by non-DAC countries to promote economic development and welfare in countries and territories in the DAC list of ODA recipients. It includes loans with a grant element of at least 25 percent (calculated at a rate of discount of 10 percent). Net official aid refers to aid flows (net of repayments) from official donors to countries and territories in part II of the DAC list of recipients: more advanced countries of Central and Eastern Europe, the countries of the former Soviet Union, and certain advanced developing countries and territories. Official aid is provided under terms and conditions similar to those for ODA. Part II of the DAC List was abolished in 2005. The collection of data on official aid and other resource flows to Part II countries ended with 2004 data. Data are in current U.S. dollars.",DT.ODA.ALLD.CD,,1960-2019,"{""unit"": ""Rate""}",21,0
14,"Personal remittances, paid (current US$)",,current US$,$,"Personal remittances comprise personal transfers and compensation of employees. Personal transfers consist of all current transfers in cash or in kind made or received by resident households to or from nonresident households. Personal transfers thus include all current transfers between resident and nonresident individuals. Compensation of employees refers to the income of border, seasonal, and other short-term workers who are employed in an economy where they are not resident and of residents employed by nonresident entities. Data are the sum of two items defined in the sixth edition of the IMF's Balance of Payments Manual: personal transfers and compensation of employees. Data are in current U.S. dollars.",BM.TRF.PWKR.CD.DT,,1970-2019,"{""unit"": ""Rate""}",80,0
19,"Personal remittances, received (% of GDP)",,% of GDP,%,"Personal remittances comprise personal transfers and compensation of employees. Personal transfers consist of all current transfers in cash or in kind made or received by resident households to or from nonresident households. Personal transfers thus include all current transfers between resident and nonresident individuals. Compensation of employees refers to the income of border, seasonal, and other short-term workers who are employed in an economy where they are not resident and of residents employed by nonresident entities. Data are the sum of two items defined in the sixth edition of the IMF's Balance of Payments Manual: personal transfers and compensation of employees.",BX.TRF.PWKR.DT.GD.ZS,,1970-2019,"{""unit"": ""Rate""}",79,0
18,"Personal remittances, received (current US$)",,current US$,$,"Personal remittances comprise personal transfers and compensation of employees. Personal transfers consist of all current transfers in cash or in kind made or received by resident households to or from nonresident households. Personal transfers thus include all current transfers between resident and nonresident individuals. Compensation of employees refers to the income of border, seasonal, and other short-term workers who are employed in an economy where they are not resident and of residents employed by nonresident entities. Data are the sum of two items defined in the sixth edition of the IMF's Balance of Payments Manual: personal transfers and compensation of employees. Data are in current U.S. dollars.",BX.TRF.PWKR.CD.DT,,1970-2019,"{""unit"": ""Rate""}",80,0
16,"Service exports (BoP, current US$)",,"BoP, current US$",$,"Services refer to economic output of intangible commodities that may be produced, transferred, and consumed at the same time. Data are in current U.S. dollars.",BX.GSR.NFSV.CD,,1960-2019,"{""unit"": ""Rate""}",42,0
93,Trade (% of GDP),,% of GDP,%,Trade is the sum of exports and imports of goods and services measured as a share of gross domestic product.,NE.TRD.GNFS.ZS,,1960-2019,"{""unit"": ""Rate""}",78,0
12,Trade in services (% of GDP),,% of GDP,%,"Trade in services is the sum of service exports and imports divided by the value of GDP, all in current U.S. dollars.",BG.GSR.NFSV.GD.ZS,,1960-2019,"{""unit"": ""Rate""}",41,0
94,"Manufacturing, value added (% of GDP)",,% of GDP,%,"Manufacturing refers to industries belonging to ISIC divisions 15-37. Value added is the net output of a sector after adding up all outputs and subtracting intermediate inputs. It is calculated without making deductions for depreciation of fabricated assets or depletion and degradation of natural resources. The origin of value added is determined by the International Standard Industrial Classification (ISIC), revision 3. Note: For VAB countries, gross value added at factor cost is used as the denominator.",NV.IND.MANF.ZS,,1960-2019,"{""unit"": ""Rate""}",78,0
23,"Total debt service (% of exports of goods, services and primary income)",,"% of exports of goods, services and primary income",%,"Total debt service to exports of goods, services and primary income. Total debt service is the sum of principal repayments and interest actually paid in currency, goods, or services on long-term debt, interest paid on short-term debt, and repayments (repurchases and charges) to the IMF.",DT.TDS.DECT.EX.ZS,,1970-2019,{},95,0
95,"Adjusted net savings, excluding particulate emission damage (current US$)",,current US$,$,"Adjusted net savings are equal to net national savings plus education expenditure and minus energy depletion, mineral depletion, net forest depletion, and carbon dioxide. This series excludes particulate emissions damage.",NY.ADJ.SVNX.CD,,1970-2019,"{""unit"": ""Percentage""}",82,0
22,Net ODA received (% of central government expense),,% of central government expense,%,"Net official development assistance (ODA) consists of disbursements of loans made on concessional terms (net of repayments of principal) and grants by official agencies of the members of the Development Assistance Committee (DAC), by multilateral institutions, and by non-DAC countries to promote economic development and welfare in countries and territories in the DAC list of ODA recipients. It includes loans with a grant element of at least 25 percent (calculated at a rate of discount of 10 percent).",DT.ODA.ODAT.XP.ZS,,1972-2019,{},22,0
105,"PPP conversion factor, private consumption (LCU per international $)",,LCU per international $,LCU,"Purchasing power parity (PPP) conversion factor is a spatial price deflator and currency converter that controls for price level differences between countries, thereby allowing volume comparisons of gross domestic product (GDP) and its expenditure components. This conversion factor is for household final consumption expenditure.",PA.NUS.PRVT.PP,,1990-2020,"{""unit"": ""Percentage""}",37,0
104,Price level ratio of PPP conversion factor (GDP) to market exchange rate,,GDP,GDP,"Price level ratio is the ratio of a purchasing power parity (PPP) conversion factor to an exchange rate. It provides a measure of the differences in price levels between countries by indicating the number of units of the common currency needed to buy the same volume of the aggregation level in each country. At the level of GDP, they provide a measure of the differences in the general price levels of countries.",PA.NUS.PPPC.RF,,1990-2019,{},37,0
75,"Air transport, freight (million ton-km)",,million ton-km,,"Air freight is the volume of freight, express, and diplomatic bags carried on each flight stage (operation of an aircraft from takeoff to its next landing), measured in metric tons times kilometers traveled.",IS.AIR.GOOD.MT.K1,,1970-2019,"{""unit"": ""%""}",36,0
76,"Air transport, passengers carried",,,,Air passengers carried include both domestic and international aircraft passengers of air carriers registered in the country.,IS.AIR.PSGR,,1970-2019,{},36,0
81,Fixed broadband subscriptions (per 100 people),,per 100 people,,"Fixed broadband subscriptions refers to fixed subscriptions to high-speed access to the public Internet (a TCP/IP connection), at downstream speeds equal to, or greater than, 256 kbit/s. This includes cable modem, DSL, fiber-to-the-home/building, other fixed (wired)-broadband subscriptions, satellite broadband and terrestrial fixed wireless broadband. This total is measured irrespective of the method of payment. It excludes subscriptions that have access to data communications (including the Internet) via mobile-cellular networks. It should include fixed WiMAX and any other fixed wireless technologies. It includes both residential subscriptions and subscriptions for organizations.",IT.NET.BBND.P2,,1998-2019,{},48,0
80,Fixed telephone subscriptions (per 100 people),,per 100 people,,"Fixed telephone subscriptions refers to the sum of active number of analogue fixed telephone lines, voice-over-IP (VoIP) subscriptions, fixed wireless local loop (WLL) subscriptions, ISDN voice-channel equivalents and fixed public payphones.",IT.MLT.MAIN.P2,,1960-2019,"{""unit"": ""DALYs per 100,000""}",48,0
83,Individuals using the Internet (% of population),,% of population,%,"Internet users are individuals who have used the Internet (from any location) in the last 3 months. The Internet can be used via a computer, mobile phone, personal digital assistant, games machine, digital TV etc.",IT.NET.USER.ZS,,1960-2019,{},48,0
78,Mobile cellular subscriptions,,,,"Mobile cellular telephone subscriptions are subscriptions to a public mobile telephone service that provide access to the PSTN using cellular technology. The indicator includes (and is split into) the number of postpaid subscriptions, and the number of active prepaid accounts (i.e. that have been used during the last three months). The indicator applies to all mobile cellular subscriptions that offer voice communications. It excludes subscriptions via data cards or USB modems, subscriptions to public mobile data services, private trunked mobile radio, telepoint, radio paging and telemetry services.",IT.CEL.SETS,,1960-2019,{},48,0
79,Mobile cellular subscriptions (per 100 people),,per 100 people,,"Mobile cellular telephone subscriptions are subscriptions to a public mobile telephone service that provide access to the PSTN using cellular technology. The indicator includes (and is split into) the number of postpaid subscriptions, and the number of active prepaid accounts (i.e. that have been used during the last three months). The indicator applies to all mobile cellular subscriptions that offer voice communications. It excludes subscriptions via data cards or USB modems, subscriptions to public mobile data services, private trunked mobile radio, telepoint, radio paging and telemetry services.",IT.CEL.SETS.P2,,1960-2019,{},48,0
46,Pump price for diesel fuel (US$ per liter),,US$ per liter,$,Fuel prices refer to the pump prices of the most widely sold grade of diesel fuel. Prices have been converted from the local currency to U.S. dollars.,EP.PMP.DESL.CD,,1991-2016,{},31,0
47,Pump price for gasoline (US$ per liter),,US$ per liter,$,Fuel prices refer to the pump prices of the most widely sold grade of gasoline. Prices have been converted from the local currency to U.S. dollars.,EP.PMP.SGAS.CD,,1991-2016,{},31,0
74,Scientific and technical journal articles,,,,"Scientific and technical journal articles refer to the number of scientific and engineering articles published in the following fields: physics, biology, chemistry, mathematics, clinical medicine, biomedical research, engineering and technology, and earth and space sciences.",IP.JRN.ARTC.SC,,2000-2018,{},49,0
82,Secure Internet servers (per 1 million people),,per 1 million people,,"The number of distinct, publicly-trusted TLS/SSL certificates found in the Netcraft Secure Server Survey.",IT.NET.SECR.P6,,2010-2020,{},50,0
77,"Railways, passengers carried (million passenger-km)",,million passenger-km,,Passengers carried by railway are the number of passengers transported by rail times kilometers traveled.,IS.RRS.PASG.KM,,1995-2019,"{""unit"": ""%"", ""shortUnit"": ""%""}",35,0
62,Research and development expenditure (% of GDP),,% of GDP,%,"Gross domestic expenditures on research and development (R&D), expressed as a percent of GDP. They include both capital and current expenditures in the four main sectors: Business enterprise, Government, Higher education and Private non-profit. R&D covers basic research, applied research, and experimental development.",GB.XPD.RSDV.GD.ZS,,1996-2018,{},56,0
242,Researchers in R&D (per million people),,per million people,,"The number of researchers engaged in Research &Development (R&D), expressed as per million. Researchers are professionals who conduct research and improve or develop concepts, theories, models techniques instrumentation, software of operational methods. R&D covers basic research, applied research, and experimental development.",SP.POP.SCIE.RD.P6,,1996-2018,"{""unit"": ""Percent""}",56,0
60,"Automated teller machines (ATMs) (per 100,000 adults)",,"per 100,000 adults",,Automated teller machines are computerized telecommunications devices that provide clients of a financial institution with access to financial transactions in a public place.,FB.ATM.TOTL.P5,,2004-2019,"{""unit"": ""%""}",44,0
61,"Commercial bank branches (per 100,000 adults)",,"per 100,000 adults",,Commercial bank branches are retail locations of resident commercial banks and other resident banks that function as commercial banks that provide financial services to customers and are physically separated from the main office but not organized as legally separated subsidiaries.,FB.CBK.BRCH.P5,,2004-2019,{},44,0
85,Armed forces personnel (% of total labor force),,% of total labor force,%,"Armed forces personnel are active duty military personnel, including paramilitary forces if the training, organization, equipment, and control suggest they may be used to support or replace regular military forces. Labor force comprises all people who meet the International Labour Organization's definition of the economically active population.",MS.MIL.TOTL.TF.ZS,,1990-2018,"{""unit"": ""US$""}",39,0
84,"Armed forces personnel, total",,,,"Armed forces personnel are active duty military personnel, including paramilitary forces if the training, organization, equipment, and control suggest they may be used to support or replace regular military forces.",MS.MIL.TOTL.P1,,1985-2018,"{""unit"": ""billion tonnes CO\u2082 equivalent""}",39,0
65,Compensation of employees (% of expense),,% of expense,%,"Compensation of employees consists of all payments in cash, as well as in kind (such as food and housing), to employees in return for services rendered, and government contributions to social insurance schemes such as social security and pensions that provide benefits to employees.",GC.XPN.COMP.ZS,,1972-2019,"{""unit"": ""ODS tonnes""}",46,0
258,"Intentional homicides (per 100,000 people)",,"per 100,000 people",,"Intentional homicides are estimates of unlawful homicides purposely inflicted as a result of domestic disputes, interpersonal violence, violent conflicts over land resources, intergang violence over turf or control, and predatory violence and killing by armed groups. Intentional homicide does not include all intentional killing; the difference is usually in the organization of the killing. Individuals or small groups usually commit homicide, whereas killing in armed conflict is usually committed by fairly cohesive groups of up to several hundred members and is thus usually excluded.",VC.IHR.PSRC.P5,,1990-2018,{},54,0
66,Interest payments (% of expense),,% of expense,%,"Interest payments include interest payments on government debt--including long-term bonds, long-term loans, and other debt instruments--to domestic and foreign residents.",GC.XPN.INTP.ZS,,1972-2019,{},46,0
257,"Internally displaced persons, new displacement associated with disasters (number of cases)",,number of cases,,"Internally displaced persons are defined according to the 1998 Guiding Principles (http://www.internal-displacement.org/publications/1998/ocha-guiding-principles-on-internal-displacement) as people or groups of people who have been forced or obliged to flee or to leave their homes or places of habitual residence, in particular as a result of armed conflict, or to avoid the effects of armed conflict, situations of generalized violence, violations of human rights, or natural or human-made disasters and who have not crossed an international border. ""New Displacement"" refers to the number of new cases or incidents of displacement recorded over the specified year, rather than the number of people displaced. This is done because people may have been displaced more than once.",VC.IDP.NWDS,,2008-2019,"{""unit"": ""hours""}",52,0
