id,name,original_metadata,unit,short_unit,description,code,coverage,timespan,display,source_id,dataset_id
86,Military expenditure (% of GDP),,% of GDP,%,"Military expenditures data from SIPRI are derived from the NATO definition, which includes all current and capital expenditures on the armed forces, including peacekeeping forces; defense ministries and other government agencies engaged in defense projects; paramilitary forces, if these are judged to be trained and equipped for military operations; and military space activities. Such expenditures include military and civil personnel, including retirement pensions of military personnel and social services for personnel; operation and maintenance; procurement; military research and development; and military aid (in the military expenditures of the donor country). Excluded are civil defense and current expenditures for previous military activities, such as for veterans' benefits, demobilization, conversion, and destruction of weapons. This definition cannot be applied for all countries, however, since that would require much more detailed information than is available about what is included in military budgets and off-budget military expenditure items. (For example, military budgets might or might not cover civil defense, reserves and auxiliary forces, police and paramilitary forces, dual-purpose forces such as military and civilian police, military grants in kind, pensions for military personnel, and social security contributions paid by one part of government to another.)",MS.MIL.XPND.GD.ZS,,1960-2019,"{""unit"": ""US$""}",51,0
67,Expense (% of GDP),,% of GDP,%,"Expense is cash payments for operating activities of the government in providing goods and services. It includes compensation of employees (such as wages and salaries), interest and subsidies, grants, social benefits, and other expenses such as rent and dividends.",GC.XPN.TOTL.GD.ZS,,1972-2019,{},45,0
63,"Revenue, excluding grants (% of GDP)",,% of GDP,%,"Revenue is cash receipts from taxes, social contributions, and other revenues such as fines, fees, rent, and income from property or sales. Grants are also considered as revenue but are excluded here.",GC.REV.XGRT.GD.ZS,,1972-2019,{},45,0
64,Tax revenue (% of GDP),,% of GDP,%,"Tax revenue refers to compulsory transfers to the central government for public purposes. Certain compulsory transfers such as fines, penalties, and most social security contributions are excluded. Refunds and corrections of erroneously collected tax revenue are treated as negative revenue.",GC.TAX.TOTL.GD.ZS,,1972-2019,{},45,0
253,Food exports (% of merchandise exports),,% of merchandise exports,%,"Food comprises the commodities in SITC sections 0 (food and live animals), 1 (beverages and tobacco), and 4 (animal and vegetable oils and fats) and SITC division 22 (oil seeds, oil nuts, and oil kernels).",TX.VAL.FOOD.ZS.UN,,1962-2019,"{""unit"": ""%""}",84,0
254,Fuel exports (% of merchandise exports),,% of merchandise exports,%,"Fuels comprise the commodities in SITC section 3 (mineral fuels, lubricants and related materials).",TX.VAL.FUEL.ZS.UN,,1962-2019,"{""unit"": ""%""}",84,0
248,"International tourism, number of arrivals",,,,"International inbound tourists (overnight visitors) are the number of tourists who travel to a country other than that in which they have their usual residence, but outside their usual environment, for a period not exceeding 12 months and whose main purpose in visiting is other than an activity remunerated from within the country visited. When data on number of tourists are not available, the number of visitors, which includes tourists, same-day visitors, cruise passengers, and crew members, is shown instead. Sources and collection methods for arrivals differ across countries. In some cases data are from border statistics (police, immigration, and the like) and supplemented by border surveys. In other cases data are from tourism accommodation establishments. For some countries number of arrivals is limited to arrivals by air and for others to arrivals staying in hotels. Some countries include arrivals of nationals residing abroad while others do not. Caution should thus be used in comparing arrivals across countries. The data on inbound tourists refer to the number of arrivals, not to the number of people traveling. Thus a person who makes several trips to a country during a given period is counted each time as a new arrival.",ST.INT.ARVL,,1995-2019,"{""unit"": ""%""}",106,0
255,Manufactures exports (% of merchandise exports),,% of merchandise exports,%,"Manufactures comprise commodities in SITC sections 5 (chemicals), 6 (basic manufactures), 7 (machinery and transport equipment), and 8 (miscellaneous manufactured goods), excluding division 68 (non-ferrous metals).",TX.VAL.MANF.ZS.UN,,1962-2019,"{""unit"": ""millions""}",84,0
68,"New business density (new registrations per 1,000 people ages 15-64)",,"new registrations per 1,000 people ages 15-64",new registrations,New businesses registered are the number of new limited liability corporations registered in the calendar year.,IC.BUS.NDNS.ZS,,2006-2018,{},88,0
256,Ores and metals exports (% of merchandise exports),,% of merchandise exports,%,"Ores and metals comprise the commodities in SITC sections 27 (crude fertilizer, minerals nes); 28 (metalliferous ores, scrap); and 68 (non-ferrous metals).",TX.VAL.MMTL.ZS.UN,,1962-2019,{},84,0
72,Time required to start a business (days),,days,days,"Time required to start a business is the number of calendar days needed to complete the procedures to legally operate a business. If a procedure can be speeded up at additional cost, the fastest procedure, independent of cost, is chosen.",IC.REG.DURS,,2003-2019,{},91,0
249,"International tourism, number of departures",,,,"International outbound tourists are the number of departures that people make from their country of usual residence to any other country for any purpose other than a remunerated activity in the country visited. The data on outbound tourists refer to the number of departures, not to the number of people traveling. Thus a person who makes several trips from a country during a given period is counted each time as a new departure.",ST.INT.DPRT,,1995-2019,"{""unit"": ""acres per fire""}",106,0
73,Investment in energy with private participation (current US$),,current US$,$,"Investment in energy projects with private participation  refers to commitments to  infrastructure projects in energy (electricity and natural gas: generation, transmission and distribution) that have reached financial closure and directly or indirectly serve the public. Movable assets and small projects such as windmills are excluded. The types of projects included are management and lease contracts, operations and management contracts with major capital expenditure, greenfield projects (in which a private entity or a public-private joint venture builds and operates a new facility), and divestitures. Investment commitments are the sum of investments in facilities and investments in government assets. Investments in facilities are the resources the project company commits to invest during the contract period either in new facilities or in expansion and modernization of existing facilities. Investments in government assets are the resources the project company spends on acquiring government assets such as state-owned enterprises, rights to provide services in a specific area, or the use of specific radio spectrums. Data are in current U.S. dollars.",IE.PPI.ENGY.CD,,1984-2020,{},96,0
251,"Tariff rate, applied, weighted mean, all products (%)",,%,%,"Weighted mean applied tariff is the average of effectively applied rates weighted by the product import shares corresponding to each partner country. Data are classified using the Harmonized System of trade at the six- or eight-digit level. Tariff line data were matched to Standard International Trade Classification (SITC) revision 3 codes to define commodity groups and import weights. To the extent possible, specific rates have been converted to their ad valorem equivalent rates and have been included in the calculation of weighted mean tariffs. Import weights were calculated using the United Nations Statistics Division's Commodity Trade (Comtrade) database. Effectively applied tariff rates at the six- and eight-digit product level are averaged for products in each commodity group. When the effectively applied rate is unavailable, the most favored nation rate is used instead.",TM.TAX.MRCH.WM.AR.ZS,,1988-2019,{},86,0
250,"Tariff rate, applied, weighted mean, manufactured products (%)",,%,%,"Weighted mean applied tariff is the average of effectively applied rates weighted by the product import shares corresponding to each partner country. Data are classified using the Harmonized System of trade at the six- or eight-digit level. Tariff line data were matched to Standard International Trade Classification (SITC) revision 3 codes to define commodity groups and import weights. To the extent possible, specific rates have been converted to their ad valorem equivalent rates and have been included in the calculation of weighted mean tariffs. Import weights were calculated using the United Nations Statistics Division's Commodity Trade (Comtrade) database. Effectively applied tariff rates at the six- and eight-digit product level are averaged for products in each commodity group. When the effectively applied rate is unavailable, the most favored nation rate is used instead. Manufactured products are commodities classified in SITC revision 3 sections 5-8 excluding division 68.",TM.TAX.MANF.WM.AR.ZS,,1988-2019,{},85,0
252,"Tariff rate, applied, weighted mean, primary products (%)",,%,%,"Weighted mean applied tariff is the average of effectively applied rates weighted by the product import shares corresponding to each partner country. Data are classified using the Harmonized System of trade at the six- or eight-digit level. Tariff line data were matched to Standard International Trade Classification (SITC) revision 3 codes to define commodity groups and import weights. To the extent possible, specific rates have been converted to their ad valorem equivalent rates and have been included in the calculation of weighted mean tariffs. Import weights were calculated using the United Nations Statistics Division's Commodity Trade (Comtrade) database. Effectively applied tariff rates at the six- and eight-digit product level are averaged for products in each commodity group. When the effectively applied rate is unavailable, the most favored nation rate is used instead. Primary products are commodities classified in SITC revision 3 sections 0-4 plus division 68 (nonferrous metals).",TM.TAX.TCOM.WM.AR.ZS,,1988-2019,{},87,0
70,Bribery incidence (% of firms experiencing at least one bribe payment request),,% of firms experiencing at least one bribe payment request,%,"Bribery incidence is the percentage of firms experiencing at least one bribe payment request across 6 public transactions dealing with utilities access, permits, licenses, and taxes.",IC.FRM.BRIB.ZS,,2006-2020,{},92,0
71,Firms with female top manager (% of firms),,% of firms,%,"Firms with female top manager refers to the percentage of firms in the private sector who have females as top managers. Top manager refers to the highest ranking manager or CEO of the establishment. This person may be the owner if he/she works as the manager of the firm. The results are based on surveys of more than 100,000 private firms.",IC.FRM.FEMM.ZS,,2007-2020,{},92,0
69,Power outages in firms in a typical month (number),,number,number,Power outages are the average number of power outages that establishments experience in a typical month.,IC.ELC.OUTG,,2006-2020,{},92,0
193,"Employment to population ratio, 15+, female (%) (modeled ILO estimate)",,modeled ILO estimate,,"Employment to population ratio is the proportion of a country's population that is employed. Employment is defined as persons of working age who, during a short reference period, were engaged in any activity to produce goods or provide services for pay or profit, whether at work during the reference period (i.e. who worked in a job for at least one hour) or not at work due to temporary absence from a job, or to working-time arrangements. Ages 15 and older are generally considered the working-age population.",SL.EMP.TOTL.SP.FE.ZS,,1991-2019,{},40,0
192,"Employment to population ratio, 15+, female (%) (national estimate)",,national estimate,,"Employment to population ratio is the proportion of a country's population that is employed. Employment is defined as persons of working age who, during a short reference period, were engaged in any activity to produce goods or provide services for pay or profit, whether at work during the reference period (i.e. who worked in a job for at least one hour) or not at work due to temporary absence from a job, or to working-time arrangements. Ages 15 and older are generally considered the working-age population.",SL.EMP.TOTL.SP.FE.NE.ZS,,1960-2020,{},40,0
219,International migrant stock (% of population),,% of population,%,"International migrant stock is the number of people born in a country other than that in which they live. It also includes refugees. The data used to estimate the international migrant stock at a particular time are obtained mainly from population censuses. The estimates are derived from the data on foreign-born population--people who have residence in one country but were born in another country. When data on the foreign-born population are not available, data on foreign population--that is, people who are citizens of a country other than the country in which they reside--are used as estimates. After the breakup of the Soviet Union in 1991 people living in one of the newly independent countries who were born in another were classified as international migrants. Estimates of migrant stock in the newly independent states from 1990 on are based on the 1989 census of the Soviet Union. For countries with information on the international migrant stock for at least two points in time, interpolation or extrapolation was used to estimate the international migrant stock on July 1 of the reference years. For countries with only one observation, estimates for the reference years were derived using rates of change in the migrant stock in the years preceding or following the single observation available. A model was used to estimate migrants for countries that had no data.",SM.POP.TOTL.ZS,,1990-2015,{},70,0
218,"International migrant stock, total",,,,"International migrant stock is the number of people born in a country other than that in which they live. It also includes refugees. The data used to estimate the international migrant stock at a particular time are obtained mainly from population censuses. The estimates are derived from the data on foreign-born population--people who have residence in one country but were born in another country. When data on the foreign-born population are not available, data on foreign population--that is, people who are citizens of a country other than the country in which they reside--are used as estimates. After the breakup of the Soviet Union in 1991 people living in one of the newly independent countries who were born in another were classified as international migrants. Estimates of migrant stock in the newly independent states from 1990 on are based on the 1989 census of the Soviet Union. For countries with information on the international migrant stock for at least two points in time, interpolation or extrapolation was used to estimate the international migrant stock on July 1 of the reference years. For countries with only one observation, estimates for the reference years were derived using rates of change in the migrant stock in the years preceding or following the single observation available. A model was used to estimate migrants for countries that had no data.",SM.POP.TOTL,,1960-2015,{},71,0
207,"Labor force participation rate, female (% of female population ages 15+) (modeled ILO estimate)",,modeled ILO estimate,,Labor force participation rate is the proportion of the population ages 15 and older that is economically active: all people who supply labor for the production of goods and services during a specified period.,SL.TLF.CACT.FE.ZS,,1990-2019,{},40,0
206,"Labor force participation rate, female (% of female population ages 15+) (national estimate)",,national estimate,,Labor force participation rate is the proportion of the population ages 15 and older that is economically active: all people who supply labor for the production of goods and services during a specified period.,SL.TLF.CACT.FE.NE.ZS,,1960-2020,{},40,0
210,"Labor force, female (% of total labor force)",,% of total labor force,%,Female labor force as a percentage of the total show the extent to which women are active in the labor force. Labor force comprises people ages 15 and older who supply labor for the production of goods and services during a specified period.,SL.TLF.TOTL.FE.ZS,,1990-2019,{},20,0
215,Net migration,,,,"Net migration is the net total of migrants during the period, that is, the total number of immigrants less the annual number of emigrants, including both citizens and noncitizens. Data are five-year estimates.",SM.POP.NETM,,1962-2017,{},73,0
209,Ratio of female to male labor force participation rate (%) (modeled ILO estimate),,modeled ILO estimate,,Labor force participation rate is the proportion of the population ages 15 and older that is economically active: all people who supply labor for the production of goods and services during a specified period. Ratio of female to male labor force participation rate is calculated by dividing female labor force participation rate by male labor force participation rate and multiplying by 100.,SL.TLF.CACT.FM.ZS,,1990-2019,{},20,0
208,Ratio of female to male labor force participation rate (%) (national estimate),,national estimate,,Labor force participation rate is the proportion of the population ages 15 and older that is economically active: all people who supply labor for the production of goods and services during a specified period. Ratio of female to male labor force participation rate is calculated by dividing female labor force participation rate by male labor force participation rate and multiplying by 100.,SL.TLF.CACT.FM.NE.ZS,,1960-2020,{},20,0
216,Refugee population by country or territory of asylum,,,,"Refugees are people who are recognized as refugees under the 1951 Convention Relating to the Status of Refugees or its 1967 Protocol, the 1969 Organization of African Unity Convention Governing the Specific Aspects of Refugee Problems in Africa, people recognized as refugees in accordance with the UNHCR statute, people granted refugee-like humanitarian status, and people provided temporary protection. Asylum seekers--people who have applied for asylum or refugee status and who have not yet received a decision or who are registered as asylum seekers--are excluded. Palestinian refugees are people (and their descendants) whose residence was Palestine between June 1946 and May 1948 and who lost their homes and means of livelihood as a result of the 1948 Arab-Israeli conflict. Country of asylum is the country where an asylum claim was filed and granted.",SM.POP.REFG,,1960-2019,{},67,0
217,Refugee population by country or territory of origin,,,,"Refugees are people who are recognized as refugees under the 1951 Convention Relating to the Status of Refugees or its 1967 Protocol, the 1969 Organization of African Unity Convention Governing the Specific Aspects of Refugee Problems in Africa, people recognized as refugees in accordance with the UNHCR statute, people granted refugee-like humanitarian status, and people provided temporary protection. Asylum seekers--people who have applied for asylum or refugee status and who have not yet received a decision or who are registered as asylum seekers--are excluded. Palestinian refugees are people (and their descendants) whose residence was Palestine between June 1946 and May 1948 and who lost their homes and means of livelihood as a result of the 1948 Arab-Israeli conflict. Country of origin generally refers to the nationality or country of citizenship of a claimant.",SM.POP.REFG.OR,,1960-2019,{},68,0
212,"Unemployment, female (% of female labor force) (modeled ILO estimate)",,modeled ILO estimate,,Unemployment refers to the share of the labor force that is without work but available for and seeking employment.,SL.UEM.TOTL.FE.ZS,,1991-2019,{},40,0
213,"Unemployment, male (% of male labor force) (modeled ILO estimate)",,modeled ILO estimate,,Unemployment refers to the share of the labor force that is without work but available for and seeking employment.,SL.UEM.TOTL.MA.ZS,,1991-2019,{},40,0
214,"Unemployment, total (% of total labor force) (modeled ILO estimate)",,modeled ILO estimate,,Unemployment refers to the share of the labor force that is without work but available for and seeking employment.,SL.UEM.TOTL.ZS,,1991-2020,{},40,0
191,Employment in agriculture (% of total employment) (modeled ILO estimate),,modeled ILO estimate,,"Employment is defined as persons of working age who were engaged in any activity to produce goods or provide services for pay or profit, whether at work during the reference period or not at work due to temporary absence from a job, or to working-time arrangement. The agriculture sector consists of activities in agriculture, hunting, forestry and fishing, in accordance with division 1 (ISIC 2) or categories A-B (ISIC 3) or category A (ISIC 4).",SL.AGR.EMPL.ZS,,1991-2019,{},40,0
189,"Employment in agriculture, female (% of female employment) (modeled ILO estimate)",,modeled ILO estimate,,"Employment is defined as persons of working age who were engaged in any activity to produce goods or provide services for pay or profit, whether at work during the reference period or not at work due to temporary absence from a job, or to working-time arrangement. The agriculture sector consists of activities in agriculture, hunting, forestry and fishing, in accordance with division 1 (ISIC 2) or categories A-B (ISIC 3) or category A (ISIC 4).",SL.AGR.EMPL.FE.ZS,,1991-2019,{},40,0
190,"Employment in agriculture, male (% of male employment) (modeled ILO estimate)",,modeled ILO estimate,,"Employment is defined as persons of working age who were engaged in any activity to produce goods or provide services for pay or profit, whether at work during the reference period or not at work due to temporary absence from a job, or to working-time arrangement. The agriculture sector consists of activities in agriculture, hunting, forestry and fishing, in accordance with division 1 (ISIC 2) or categories A-B (ISIC 3) or category A (ISIC 4).",SL.AGR.EMPL.MA.ZS,,1991-2019,{},40,0
196,Employment in industry (% of total employment) (modeled ILO estimate),,modeled ILO estimate,,"Employment is defined as persons of working age who were engaged in any activity to produce goods or provide services for pay or profit, whether at work during the reference period or not at work due to temporary absence from a job, or to working-time arrangement. The industry sector consists of mining and quarrying, manufacturing, construction, and public utilities (electricity, gas, and water), in accordance with divisions 2-5 (ISIC 2) or categories C-F (ISIC 3) or categories B-F (ISIC 4).",SL.IND.EMPL.ZS,,1991-2019,{},40,0
194,"Employment in industry, female (% of female employment) (modeled ILO estimate)",,modeled ILO estimate,,"Employment is defined as persons of working age who were engaged in any activity to produce goods or provide services for pay or profit, whether at work during the reference period or not at work due to temporary absence from a job, or to working-time arrangement. The industry sector consists of mining and quarrying, manufacturing, construction, and public utilities (electricity, gas, and water), in accordance with divisions 2-5 (ISIC 2) or categories C-F (ISIC 3) or categories B-F (ISIC 4).",SL.IND.EMPL.FE.ZS,,1991-2019,{},40,0
195,"Employment in industry, male (% of male employment) (modeled ILO estimate)",,modeled ILO estimate,,"Employment is defined as persons of working age who were engaged in any activity to produce goods or provide services for pay or profit, whether at work during the reference period or not at work due to temporary absence from a job, or to working-time arrangement. The industry sector consists of mining and quarrying, manufacturing, construction, and public utilities (electricity, gas, and water), in accordance with divisions 2-5 (ISIC 2) or categories C-F (ISIC 3) or categories B-F (ISIC 4).",SL.IND.EMPL.MA.ZS,,1991-2019,{},40,0
199,Employment in services (% of total employment) (modeled ILO estimate),,modeled ILO estimate,,"Employment is defined as persons of working age who were engaged in any activity to produce goods or provide services for pay or profit, whether at work during the reference period or not at work due to temporary absence from a job, or to working-time arrangement. The services sector consists of wholesale and retail trade and restaurants and hotels; transport, storage, and communications; financing, insurance, real estate, and business services; and community, social, and personal services, in accordance with divisions 6-9 (ISIC 2) or categories G-Q (ISIC 3) or categories G-U (ISIC 4).",SL.SRV.EMPL.ZS,,1991-2019,{},40,0
