name,unit,dataset_id,id
"Educational attainment, at least completed upper secondary, population 25+, male (%) (cumulative)",,56,836
"Educational attainment, at least completed upper secondary, population 25+, total (%) (cumulative)",,56,837
"Secondary education, duration (years)",,56,838
"Secondary education, pupils",,57,839
"Secondary education, pupils (% female)",,57,840
"Secondary education, general pupils",,57,841
"Secondary education, general pupils (% female)",,57,842
"Pupil-teacher ratio, lower secondary",,58,843
"Pupil-teacher ratio, secondary",,58,844
"Pupil-teacher ratio, upper secondary",,58,845
"Secondary education, vocational pupils",,57,846
"Secondary education, vocational pupils (% female)",,57,847
"School enrollment, secondary (% gross)",,57,848
"School enrollment, secondary, female (% gross)",,57,849
"School enrollment, secondary, male (% gross)",,57,850
"School enrollment, secondary (% net)",,57,851
"School enrollment, secondary, female (% net)",,57,852
"School enrollment, secondary, male (% net)",,57,853
"School enrollment, secondary, private (% of total secondary)",,57,854
"Progression to secondary school, female (%)",,59,855
"Progression to secondary school, male (%)",,59,856
Progression to secondary school (%),,59,857
"Trained teachers in secondary education, female (% of female teachers)",,58,858
"Trained teachers in lower secondary education, female (% of female teachers)",,58,859
"Trained teachers in lower secondary education, male (% of male teachers)",,58,860
Trained teachers in lower secondary education (% of total teachers),,58,861
"Trained teachers in secondary education, male (% of male teachers)",,58,862
"Trained teachers in upper secondary education, female (% of female teachers)",,58,863
"Trained teachers in upper secondary education, male (% of male teachers)",,58,864
Trained teachers in upper secondary education (% of total teachers),,58,865
Trained teachers in secondary education (% of total teachers),,58,866
"Secondary education, teachers",,58,867
"Secondary education, teachers, female",,58,868
"Secondary education, teachers (% female)",,58,869
"Adolescents out of school, female (% of female lower secondary school age)",,57,870
"Adolescents out of school, male (% of male lower secondary school age)",,57,871
Adolescents out of school (% of lower secondary school age),,57,872
"Educational attainment, at least Bachelor's or equivalent, population 25+, female (%) (cumulative)",,56,873
"Educational attainment, at least Bachelor's or equivalent, population 25+, male (%) (cumulative)",,56,874
"Educational attainment, at least Bachelor's or equivalent, population 25+, total (%) (cumulative)",,56,875
"Educational attainment, Doctoral or equivalent, population 25+, female (%) (cumulative)",,56,876
"Educational attainment, Doctoral or equivalent, population 25+, male (%) (cumulative)",,56,877
"Educational attainment, Doctoral or equivalent, population 25+, total (%) (cumulative)",,56,878
"Educational attainment, at least Master's or equivalent, population 25+, female (%) (cumulative)",,56,879
"Educational attainment, at least Master's or equivalent, population 25+, male (%) (cumulative)",,56,880
"Educational attainment, at least Master's or equivalent, population 25+, total (%) (cumulative)",,56,881
"Educational attainment, at least completed short-cycle tertiary, population 25+, female (%) (cumulative)",,56,882
"Educational attainment, at least completed short-cycle tertiary, population 25+, male (%) (cumulative)",,56,883
"Educational attainment, at least completed short-cycle tertiary, population 25+, total (%) (cumulative)",,56,884
"Pupil-teacher ratio, tertiary",,58,885
"School enrollment, tertiary (% gross)",,57,886
"School enrollment, tertiary, female (% gross)",,57,887
"School enrollment, tertiary, male (% gross)",,57,888
"Tertiary education, academic staff (% female)",,58,889
"Current education expenditure, primary (% of total expenditure in primary public institutions)",,58,890
"Current education expenditure, secondary (% of total expenditure in secondary public institutions)",,58,891
"Current education expenditure, tertiary (% of total expenditure in tertiary public institutions)",,58,892
"Current education expenditure, total (% of total expenditure in public institutions)",,58,893
"Government expenditure per student, primary (% of GDP per capita)",,58,894
Expenditure on primary education (% of government expenditure on education),,58,895
"Government expenditure per student, secondary (% of GDP per capita)",,58,896
Expenditure on secondary education (% of government expenditure on education),,58,897
"Government expenditure per student, tertiary (% of GDP per capita)",,58,898
Expenditure on tertiary education (% of government expenditure on education),,58,899
"Government expenditure on education, total (% of government expenditure)",,58,900
"Government expenditure on education, total (% of GDP)",,58,901
"Women participating in the three decisions (own health care, major household purchases, and visiting family) (% of women age 15-49)",,60,902
"Women making their own informed decisions regarding sexual relations, contraceptive use and reproductive health care  (% of women age 15-49)",,60,903
Proportion of seats held by women in national parliaments (%),,60,904
Nonpregnant and nonnursing women can do the same jobs as men (1=yes; 0=no),,61,905
Law prohibits or invalidates child or early marriage (1=yes; 0=no),,60,906
Law mandates equal remuneration for females and males for work of equal value (1=yes; 0=no),,60,907
Law mandates paid or unpaid maternity leave (1=yes; 0=no),,60,908
Law mandates nondiscrimination based on gender in hiring (1=yes; 0=no),,60,909
Legislation exists on domestic violence (1=yes; 0=no),,60,910
Mothers are guaranteed an equivalent position after maternity leave (1=yes; 0=no),,60,911
Nondiscrimination clause mentions gender in the constitution (1=yes; 0=no),,60,912
"Proportion of time spent on unpaid domestic and care work, female (% of 24 hour day)",,61,913
"Proportion of time spent on unpaid domestic and care work, male (% of 24 hour day)",,61,914
Proportion of women subjected to physical and/or sexual violence in the last 12 months (% of women age 15-49),,62,915
Women who believe a husband is justified in beating his wife when she argues with him (%),,62,916
Women who believe a husband is justified in beating his wife when she burns the food (%),,62,917
Women who believe a husband is justified in beating his wife when she goes out without telling him (%),,62,918
Women who believe a husband is justified in beating his wife when she neglects the children (%),,62,919
Women who believe a husband is justified in beating his wife (any of five reasons) (%),,62,920
Women who believe a husband is justified in beating his wife when she refuses sex with him (%),,62,921
"Total alcohol consumption per capita, female (liters of pure alcohol, projected estimates, female 15+ years of age)",,63,922
"Total alcohol consumption per capita (liters of pure alcohol, projected estimates, 15+ years of age)",,63,923
"Total alcohol consumption per capita, male (liters of pure alcohol, projected estimates, male 15+ years of age)",,63,924
Prevalence of anemia among women of reproductive age (% of women ages 15-49),,64,925
Prevalence of anemia among children (% of children under 5),,64,926
Prevalence of anemia among non-pregnant women (% of women ages 15-49),,64,927
"Condom use, population ages 15-24, female (% of females ages 15-24)",,65,928
"Condom use, population ages 15-24, male (% of males ages 15-24)",,65,929
Number of deaths ages 5-14 years,,66,930
"Cause of death, by communicable diseases and maternal, prenatal and nutrition conditions (% of total)",,63,931
Number of infant deaths,,66,932
"Cause of death, by injury (% of total)",,63,933
Number of under-five deaths,,66,934
"Cause of death, by non-communicable diseases (% of total)",,63,935
Number of neonatal deaths,,66,936
"Probability of dying at age 5-14 years (per 1,000 children age 5)",,66,937
Women's share of population ages 15+ living with HIV (%),,63,938
"Prevalence of HIV, total (% of population ages 15-49)",,63,939
"Mortality rate, under-5 (per 1,000 live births)",,66,940
"Mortality rate, under-5, female (per 1,000 live births)",,66,941
"Mortality rate, under-5, male (per 1,000 live births)",,66,942
"Mortality from CVD, cancer, diabetes or CRD between exact ages 30 and 70, female (%)",,66,943
"Mortality from CVD, cancer, diabetes or CRD between exact ages 30 and 70, male (%)",,66,944
"Mortality from CVD, cancer, diabetes or CRD between exact ages 30 and 70 (%)",,66,945
"Mortality rate, neonatal (per 1,000 live births)",,66,946
Demand for family planning satisfied by modern methods (% of married women with demand for family planning),,67,947
"People using at least basic drinking water services, rural (% of rural population)",,65,948
"People using at least basic drinking water services, urban (% of urban population)",,65,949
People using at least basic drinking water services (% of population),,65,950
"People using safely managed drinking water services, rural (% of rural population)",,65,951
"People using safely managed drinking water services, urban (% of urban population)",,65,952
People using safely managed drinking water services (% of population),,65,953
Children (0-14) living with HIV,,63,954
"Prevalence of HIV, female (% ages 15-24)",,63,955
"Prevalence of HIV, male (% ages 15-24)",,63,956
Antiretroviral therapy coverage (% of people living with HIV),,63,957
Adults (ages 15+) newly infected with HIV,,63,958
Children (ages 0-14) newly infected with HIV,,63,959
Adults (ages 15+) and children (ages 0-14) newly infected with HIV,,63,960
"Incidence of HIV (per 1,000 uninfected population ages 15-49)",,63,961
Antiretroviral therapy coverage for PMTCT (% of pregnant women living with HIV),,63,962
"Immunization, HepB3 (% of one-year-old children)",,65,963
"Immunization, DPT (% of children ages 12-23 months)",,65,964
"Immunization, measles (% of children ages 12-23 months)",,65,965
"Hospital beds (per 1,000 people)",,68,966
"Community health workers (per 1,000 people)",,68,967
"Nurses and midwives (per 1,000 people)",,68,968
"Physicians (per 1,000 people)",,68,969
"Specialist surgical workforce (per 100,000 population)",,68,970
"Incidence of malaria (per 1,000 population at risk)",,63,971
Use of insecticide-treated bed nets (% of under-5 population),,65,972
Children with fever receiving antimalarial drugs (% of children under age 5 with fever),,65,973
Number of maternal deaths,,67,974
Lifetime risk of maternal death (1 in: rate varies by country),,67,975
Lifetime risk of maternal death (%),,67,976
Prevalence of anemia among pregnant women (%),,64,977
"Smoking prevalence, total (ages 15+)",,63,978
"Smoking prevalence, females (% of adults)",,63,979
"Smoking prevalence, males (% of adults)",,63,980
Risk of catastrophic expenditure for surgical care (% of people at risk),,63,981
Risk of impoverishing expenditure for surgical care (% of people at risk),,63,982
"Number of surgical procedures (per 100,000 population)",,68,983
"Mortality rate attributed to household and ambient air pollution, age-standardized, female (per 100,000 female population)",,66,984
"Mortality rate attributed to household and ambient air pollution, age-standardized, male (per 100,000 male population)",,66,985
"Mortality rate attributed to household and ambient air pollution, age-standardized (per 100,000 population)",,66,986
Pregnant women receiving prenatal care (%),,67,987
ARI treatment (% of children under 5 taken to a health provider),,65,988
"People using at least basic sanitation services, rural (% of rural population)",,65,989
"People using at least basic sanitation services, urban (% of urban population)",,65,990
People using at least basic sanitation services (% of population),,65,991
Exclusive breastfeeding (% of children under 6 months),,64,992
Births attended by skilled health staff (% of total),,67,993
Low-birthweight babies (% of births),,64,994
Diabetes prevalence (% of population ages 20 to 79),,63,995
Female genital mutilation prevalence (%),,63,996
"People with basic handwashing facilities including soap and water, rural (% of rural population)",,65,997
"People with basic handwashing facilities including soap and water, urban (% of urban population)",,65,998
People with basic handwashing facilities including soap and water (% of population),,65,999
"Prevalence of underweight, weight for age, female (% of children under 5)",,64,1000
"Prevalence of underweight, weight for age, male (% of children under 5)",,64,1001
"Prevalence of underweight, weight for age (% of children under 5)",,64,1002
"Maternal mortality ratio (modeled estimate, per 100,000 live births)",,67,1003
"Maternal mortality ratio (national estimate, per 100,000 live births)",,67,1004
"People practicing open defecation, rural (% of rural population)",,63,1005
"People practicing open defecation, urban (% of urban population)",,63,1006
People practicing open defecation (% of population),,63,1007
Diarrhea treatment (% of children under 5 receiving oral rehydration and continued feeding),,65,1008
Diarrhea treatment (% of children under 5 who received ORS packet),,65,1009
"Prevalence of overweight, weight for height, female (% of children under 5)",,64,1010
"Prevalence of overweight, weight for height, male (% of children under 5)",,64,1011
"Prevalence of overweight, weight for height (% of children under 5)",,64,1012
"Mortality rate attributed to unintentional poisoning (per 100,000 population)",,66,1013
"Mortality rate attributed to unintentional poisoning, female (per 100,000 female population)",,66,1014
"Mortality rate attributed to unintentional poisoning, male (per 100,000 male population)",,66,1015
"People using safely managed sanitation services, rural (% of rural population)",,65,1016
"People using safely managed sanitation services, urban (% of urban population)",,65,1017
People using safely managed sanitation services (% of population),,65,1018
"Prevalence of stunting, height for age, female (% of children under 5)",,64,1019
"Prevalence of stunting, height for age, male (% of children under 5)",,64,1020
"Prevalence of stunting, height for age (% of children under 5)",,64,1021
"Suicide mortality rate, female (per 100,000 female population)",,66,1022
"Suicide mortality rate, male (per 100,000 male population)",,66,1023
"Suicide mortality rate (per 100,000 population)",,66,1024
"Mortality caused by road traffic injury (per 100,000 people)",,66,1025
"Mortality rate attributed to unsafe water, unsafe sanitation and lack of hygiene (per 100,000 population)",,66,1026
"Prevalence of wasting, weight for height, female (% of children under 5)",,64,1027
"Prevalence of wasting, weight for height, male (% of children under 5)",,64,1028
"Prevalence of wasting, weight for height (% of children under 5)",,64,1029
"Prevalence of severe wasting, weight for height, female (% of children under 5)",,64,1030
"Prevalence of severe wasting, weight for height, male (% of children under 5)",,64,1031
"Prevalence of severe wasting, weight for height (% of children under 5)",,64,1032
Tuberculosis treatment success rate (% of new cases),,65,1033
"Tuberculosis case detection rate (%, all forms)",,65,1034
"Incidence of tuberculosis (per 100,000 people)",,63,1035
Increase in poverty gap at $1.90 ($ 2011 PPP) poverty line due to out-of-pocket health care expenditure (USD),,69,1036
Number of people pushed below the $1.90 ($ 2011 PPP) poverty line by out-of-pocket health care expenditure,,69,1037
Increase in poverty gap at $1.90 ($ 2011 PPP) poverty line due to out-of-pocket health care expenditure (% of poverty line),,69,1038
Proportion of population pushed below the $1.90 ($ 2011 PPP) poverty line by out-of-pocket health care expenditure (%),,69,1039
Increase in poverty gap at $3.20 ($ 2011 PPP) poverty line due to out-of-pocket health care expenditure (USD),,69,1040
Number of people pushed below the $3.20 ($ 2011 PPP) poverty line by out-of-pocket health care expenditure,,69,1041
Increase in poverty gap at $3.20 ($ 2011 PPP) poverty line due to out-of-pocket health care expenditure (% of poverty line),,69,1042
Proportion of population pushed below the $3.20 ($ 2011 PPP) poverty line by out-of-pocket health care expenditure (%),,69,1043
Number of people spending more than 10% of household consumption or income on out-of-pocket health care expenditure,,69,1044
Proportion of population spending more than 10% of household consumption or income on out-of-pocket health care expenditure (%),,69,1045
Number of people spending more than 25% of household consumption or income on out-of-pocket health care expenditure,,69,1046
Proportion of population spending more than 25% of household consumption or income on out-of-pocket health care expenditure (%),,69,1047
UHC service coverage index,,69,1048
Newborns protected against tetanus (%),,67,1049
Current health expenditure (% of GDP),,68,1050
Current health expenditure per capita (current US$),,68,1051
"Current health expenditure per capita, PPP (current international $)",,68,1052
External health expenditure (% of current health expenditure),,68,1053
External health expenditure per capita (current US$),,68,1054
"External health expenditure per capita, PPP (current international $)",,68,1055
Domestic general government health expenditure (% of current health expenditure),,68,1056
Domestic general government health expenditure (% of GDP),,68,1057
Domestic general government health expenditure (% of general government expenditure),,68,1058
Domestic general government health expenditure per capita (current US$),,68,1059
"Domestic general government health expenditure per capita, PPP (current international $)",,68,1060
Out-of-pocket expenditure (% of current health expenditure),,68,1061
Out-of-pocket expenditure per capita (current US$),,68,1062
"Out-of-pocket expenditure per capita, PPP (current international $)",,68,1063
Domestic private health expenditure (% of current health expenditure),,68,1064
Domestic private health expenditure per capita (current US$),,68,1065
"Domestic private health expenditure per capita, PPP  (current international $)",,68,1066
Income share held by second 20%,%,70,1067
Income share held by third 20%,%,70,1068
Income share held by fourth 20%,%,70,1069
Income share held by highest 20%,%,70,1070
Income share held by highest 10%,%,70,1071
Income share held by lowest 10%,%,70,1072
Income share held by lowest 20%,%,70,1073
Poverty headcount ratio at $1.90 a day (2011 PPP) (% of population),%,71,1074
Poverty gap at $1.90 a day (2011 PPP) (%),%,71,1075
GINI index (World Bank estimate),%,70,1076
Poverty headcount ratio at $3.20 a day (2011 PPP) (% of population),%,71,1077
Poverty gap at $3.20 a day (2011 PPP) (%),%,71,1078
Poverty gap at national poverty lines (%),,71,1079
Poverty headcount ratio at national poverty lines (% of population),,71,1080
Rural poverty gap at national poverty lines (%),,71,1081
Rural poverty headcount ratio at national poverty lines (% of rural population),,71,1082
Poverty headcount ratio at $5.50 a day (2011 PPP) (% of population),%,71,1083
Poverty gap at $5.50 a day (2011 PPP) (%),%,71,1084
Urban poverty gap at national poverty lines (%),,71,1085
Urban poverty headcount ratio at national poverty lines (% of urban population),,71,1086
Average transaction cost of sending remittances to a specific country (%),,22,1087
Average transaction cost of sending remittances from a specific country (%),,22,1088
"Survey mean consumption or income per capita, bottom 40% of population (2011 PPP $ per day)",2011 PPP $,72,1089
"Annualized average growth rate in per capita real survey mean consumption or income, bottom 40% of population (%)",%,72,1090
"Survey mean consumption or income per capita, total population (2011 PPP $ per day)",2011 PPP $,72,1091
"Annualized average growth rate in per capita real survey mean consumption or income, total population (%)",%,72,1092
"Child employment in agriculture, female (% of female economically active children ages 7-14)",,73,1093
"Child employment in agriculture, male (% of male economically active children ages 7-14)",,73,1094
Child employment in agriculture (% of economically active children ages 7-14),,73,1095
"Employment in agriculture, female (% of female employment) (modeled ILO estimate)",,73,1096
"Employment in agriculture, male (% of male employment) (modeled ILO estimate)",,73,1097
Employment in agriculture (% of total employment) (modeled ILO estimate),,73,1098
"Employment to population ratio, ages 15-24, female (%) (national estimate)",,73,1099
"Employment to population ratio, ages 15-24, female (%) (modeled ILO estimate)",,73,1100
"Employment to population ratio, ages 15-24, male (%) (national estimate)",,73,1101
"Employment to population ratio, ages 15-24, male (%) (modeled ILO estimate)",,73,1102
"Employment to population ratio, ages 15-24, total (%) (national estimate)",,73,1103
"Employment to population ratio, ages 15-24, total (%) (modeled ILO estimate)",,73,1104
"Employers, female (% of female employment) (modeled ILO estimate)",,73,1105
"Employers, male (% of male employment) (modeled ILO estimate)",,73,1106
"Employers, total (% of total employment) (modeled ILO estimate)",,73,1107
"Self-employed, female (% of female employment) (modeled ILO estimate)",,73,1108
"Self-employed, male (% of male employment) (modeled ILO estimate)",,73,1109
"Self-employed, total (% of total employment) (modeled ILO estimate)",,73,1110
Female share of employment in senior and middle management (%),,73,1111
"Employment to population ratio, 15+, female (%) (national estimate)",,73,1112
"Employment to population ratio, 15+, female (%) (modeled ILO estimate)",,73,1113
"Employment to population ratio, 15+, male (%) (national estimate)",,73,1114
"Employment to population ratio, 15+, male (%) (modeled ILO estimate)",,73,1115
"Employment to population ratio, 15+, total (%) (national estimate)",,73,1116
"Employment to population ratio, 15+, total (%) (modeled ILO estimate)",,73,1117
"Vulnerable employment, female (% of female employment) (modeled ILO estimate)",,73,1118
"Vulnerable employment, male (% of male employment) (modeled ILO estimate)",,73,1119
"Vulnerable employment, total (% of total employment) (modeled ILO estimate)",,73,1120
"Wage and salaried workers, female (% of female employment) (modeled ILO estimate)",,73,1121
"Wage and salaried workers, male (% of male employment) (modeled ILO estimate)",,73,1122
"Wage and salaried workers, total (% of total employment) (modeled ILO estimate)",,73,1123
"Children in employment, unpaid family workers, female (% of female children in employment, ages 7-14)",,73,1124
"Children in employment, unpaid family workers, male (% of male children in employment, ages 7-14)",,73,1125
"Children in employment, unpaid family workers (% of children in employment, ages 7-14)",,73,1126
"Contributing family workers, female (% of female employment) (modeled ILO estimate)",,73,1127
"Contributing family workers, male (% of male employment) (modeled ILO estimate)",,73,1128
"Contributing family workers, total (% of total employment) (modeled ILO estimate)",,73,1129
GDP per person employed (constant 2011 PPP $),,73,1130
"Employment in industry, female (% of female employment) (modeled ILO estimate)",,73,1131
"Employment in industry, male (% of male employment) (modeled ILO estimate)",,73,1132
Employment in industry (% of total employment) (modeled ILO estimate),,73,1133
"Informal employment, female (% of total non-agricultural employment)",,73,1134
"Informal employment, male (% of total non-agricultural employment)",,73,1135
Informal employment (% of total non-agricultural employment),,73,1136
"Child employment in manufacturing, female (% of female economically active children ages 7-14)",,73,1137
"Child employment in manufacturing, male (% of male economically active children ages 7-14)",,73,1138
Child employment in manufacturing (% of economically active children ages 7-14),,73,1139
"Children in employment, self-employed, female (% of female children in employment, ages 7-14)",,73,1140
"Children in employment, self-employed, male (% of male children in employment, ages 7-14)",,73,1141
"Children in employment, self-employed (% of children in employment, ages 7-14)",,73,1142
"Child employment in services, female (% of female economically active children ages 7-14)",,73,1143
"Child employment in services, male (% of male economically active children ages 7-14)",,73,1144
Child employment in services (% of economically active children ages 7-14),,73,1145
"Employment in services, female (% of female employment) (modeled ILO estimate)",,73,1146
"Employment in services, male (% of male employment) (modeled ILO estimate)",,73,1147
Employment in services (% of total employment) (modeled ILO estimate),,73,1148
"Children in employment, female (% of female children ages 7-14)",,73,1149
"Children in employment, male (% of male children ages 7-14)",,73,1150
"Average working hours of children, study and work, female, ages 7-14 (hours per week)",,73,1151
"Children in employment, study and work, female (% of female children in employment, ages 7-14)",,73,1152
"Average working hours of children, study and work, male, ages 7-14 (hours per week)",,73,1153
"Children in employment, study and work, male (% of male children in employment, ages 7-14)",,73,1154
"Average working hours of children, study and work, ages 7-14 (hours per week)",,73,1155
"Children in employment, study and work (% of children in employment, ages 7-14)",,73,1156
"Average working hours of children, working only, female, ages 7-14 (hours per week)",,73,1157
"Children in employment, work only, female (% of female children in employment, ages 7-14)",,73,1158
"Average working hours of children, working only, male, ages 7-14 (hours per week)",,73,1159
