name,unit,dataset_id,id
Firms visited or required meetings with tax officials (% of firms),,32,417
Value lost due to electrical outages (% of sales for affected firms),,32,418
Firms that spend on R&D (% of firms),,32,419
Firms experiencing losses due to theft and vandalism (% of firms),,32,420
Firms offering formal training (% of firms),,32,421
Time spent dealing with the requirements of government regulations (% of senior management time),,32,422
"Cost to import, border compliance (US$)",,33,423
"Cost to import, documentary compliance (US$)",,33,424
"Time to import, border compliance (hours)",,33,425
"Time to import, documentary compliance (hours)",,33,426
Time to resolve insolvency (years),,32,427
Strength of legal rights index (0=weak to 12=strong),,32,428
Time required to enforce a contract (days),,32,429
Time required to register property (days),,32,430
Procedures to register property (number),,32,431
"Cost of business start-up procedures, female (% of GNI per capita)",,32,432
"Cost of business start-up procedures, male (% of GNI per capita)",,32,433
Cost of business start-up procedures (% of GNI per capita),,32,434
Time required to start a business (days),,32,435
"Time required to start a business, female (days)",,32,436
"Time required to start a business, male (days)",,32,437
Start-up procedures to register a business (number),,32,438
"Start-up procedures to register a business, female (number)",,32,439
"Start-up procedures to register a business, male (number)",,32,440
Time to prepare and pay taxes (hours),,32,441
Firms expected to give gifts in meetings with tax officials (% of firms),,32,442
Labor tax and contributions (% of commercial profits),,32,443
Number of visits or required meetings with tax officials (average for affected firms),,32,444
Other taxes payable by businesses (% of commercial profits),,32,445
Tax payments (number),,32,446
Profit tax (% of commercial profits),,32,447
Total tax rate (% of commercial profits),,32,448
Time required to build a warehouse (days),,32,449
Procedures to build a warehouse (number),,32,450
Investment in energy with private participation (current US$),,34,451
Investment in ICT with private participation (current US$),,34,452
Investment in transport with private participation (current US$),,34,453
Investment in water and sanitation with private participation (current US$),,34,454
Public private partnerships investment in energy (current US$),,34,455
Public private partnerships investment in ICT (current US$),,34,456
Public private partnerships investment in transport (current US$),,34,457
Public private partnerships investment in water and sanitation (current US$),,34,458
"Industrial design applications, nonresident, by count",,26,459
"Industrial design applications, resident, by count",,26,460
Scientific and technical journal articles,,26,461
"Patent applications, nonresidents",,26,462
"Patent applications, residents",,26,463
"Trademark applications, nonresident, by count",,26,464
"Trademark applications, direct nonresident",,26,465
"Trademark applications, direct resident",,26,466
"Trademark applications, resident, by count",,26,467
"Trademark applications, total",,26,468
CPIA business regulatory environment rating (1=low to 6=high),,31,469
CPIA debt policy rating (1=low to 6=high),,31,470
CPIA economic management cluster average (1=low to 6=high),,31,471
CPIA policy and institutions for environmental sustainability rating (1=low to 6=high),,31,472
CPIA quality of budgetary and financial management rating (1=low to 6=high),,31,473
CPIA financial sector rating (1=low to 6=high),,31,474
CPIA fiscal policy rating (1=low to 6=high),,31,475
CPIA gender equality rating (1=low to 6=high),,31,476
CPIA building human resources rating (1=low to 6=high),,31,477
IDA resource allocation index (1=low to 6=high),,31,478
CPIA macroeconomic management rating (1=low to 6=high),,31,479
CPIA quality of public administration rating (1=low to 6=high),,31,480
CPIA equity of public resource use rating (1=low to 6=high),,31,481
CPIA property rights and rule-based governance rating (1=low to 6=high),,31,482
CPIA social protection rating (1=low to 6=high),,31,483
CPIA public sector management and institutions cluster average (1=low to 6=high),,31,484
CPIA efficiency of revenue mobilization rating (1=low to 6=high),,31,485
CPIA policies for social inclusion/equity cluster average (1=low to 6=high),,31,486
CPIA structural policies cluster average (1=low to 6=high),,31,487
CPIA trade rating (1=low to 6=high),,31,488
"CPIA transparency, accountability, and corruption in the public sector rating (1=low to 6=high)",,31,489
Methodology assessment of statistical capacity (scale 0 - 100),,31,490
Overall level of statistical capacity (scale 0 - 100),,31,491
Periodicity and timeliness assessment of statistical capacity (scale 0 - 100),,31,492
Source data assessment of statistical capacity (scale 0 - 100),,31,493
"Burden of customs procedure, WEF (1=extremely inefficient to 7=extremely efficient)",,19,494
"Quality of port infrastructure, WEF (1=extremely underdeveloped to 7=well developed and efficient by international standards)",,19,495
"Air transport, registered carrier departures worldwide",,19,496
"Air transport, freight (million ton-km)",,19,497
"Air transport, passengers carried",,19,498
"Railways, goods transported (million ton-km)",,19,499
"Railways, passengers carried (million passenger-km)",,19,500
Rail lines (total route-km),,19,501
Liner shipping connectivity index (maximum value in 2004 = 100),,19,502
Container port traffic (TEU: 20 foot equivalent units),,19,503
Mobile cellular subscriptions,,7,504
Mobile cellular subscriptions (per 100 people),,7,505
Fixed telephone subscriptions,,7,506
Fixed telephone subscriptions (per 100 people),,7,507
Fixed broadband subscriptions,,7,508
Fixed broadband subscriptions (per 100 people),,7,509
Secure Internet servers,,7,510
Secure Internet servers (per 1 million people),,7,511
Individuals using the Internet (% of population),,7,512
"Lead time to export, median case (days)",,33,513
"Lead time to import, median case (days)",,33,514
Logistics performance index: Efficiency of customs clearance process (1=low to 5=high),,33,515
Logistics performance index: Quality of trade and transport-related infrastructure (1=low to 5=high),,33,516
Logistics performance index: Ease of arranging competitively priced shipments (1=low to 5=high),,33,517
Logistics performance index: Competence and quality of logistics services (1=low to 5=high),,33,518
Logistics performance index: Overall (1=low to 5=high),,33,519
Logistics performance index: Frequency with which shipments reach consignee within scheduled or expected time (1=low to 5=high),,33,520
Logistics performance index: Ability to track and trace consignments (1=low to 5=high),,33,521
Arms imports (SIPRI trend indicator values),,35,522
"Armed forces personnel, total",,35,523
Armed forces personnel (% of total labor force),,35,524
Military expenditure (current USD),,35,525
Military expenditure (current LCU),,35,526
Military expenditure (% of GDP),,35,527
Military expenditure (% of general government expenditure),,35,528
Arms exports (SIPRI trend indicator values),,35,529
General government final consumption expenditure (current US$),,36,530
General government final consumption expenditure (current LCU),,37,531
General government final consumption expenditure (constant 2010 US$),,38,532
General government final consumption expenditure (annual % growth),,39,533
General government final consumption expenditure (constant LCU),,40,534
General government final consumption expenditure (% of GDP),,41,535
Household final consumption expenditure (current US$),,36,536
Household final consumption expenditure (current LCU),,37,537
Household final consumption expenditure (constant 2010 US$),,38,538
Household final consumption expenditure (annual % growth),,39,539
Household final consumption expenditure (constant LCU),,40,540
Household final consumption expenditure per capita (constant 2010 US$),,38,541
Household final consumption expenditure per capita growth (annual %),,39,542
"Household final consumption expenditure, PPP (current international $)",,42,543
"Household final consumption expenditure, PPP (constant 2011 international $)",,42,544
Households and NPISHs final consumption expenditure (% of GDP),,41,545
Final consumption expenditure (current US$),,36,546
Final consumption expenditure (current LCU),,37,547
Final consumption expenditure (constant 2010 US$),,38,548
Final consumption expenditure (annual % growth),,39,549
Final consumption expenditure (constant LCU),,40,550
Final consumption expenditure (% of GDP),,41,551
Gross national expenditure deflator (base year varies by country),,41,552
Gross national expenditure (current US$),,36,553
Gross national expenditure (current LCU),,37,554
Gross national expenditure (constant 2010 US$),,38,555
Gross national expenditure (constant LCU),,40,556
Gross national expenditure (% of GDP),,41,557
Exports of goods and services (current US$),,36,558
Exports of goods and services (current LCU),,37,559
Exports of goods and services (constant 2010 US$),,38,560
Exports of goods and services (annual % growth),,39,561
Exports of goods and services (constant LCU),,40,562
Exports of goods and services (% of GDP),,41,563
"Gross fixed capital formation, private sector (current LCU)",,37,564
"Gross fixed capital formation, private sector (% of GDP)",,41,565
Gross fixed capital formation (current US$),,36,566
Gross fixed capital formation (current LCU),,37,567
Gross fixed capital formation (constant 2010 US$),,38,568
Gross fixed capital formation (annual % growth),,39,569
Gross fixed capital formation (constant LCU),,40,570
Gross fixed capital formation (% of GDP),,41,571
Changes in inventories (current US$),,36,572
Changes in inventories (current LCU),,37,573
Changes in inventories (constant LCU),,40,574
Gross capital formation (current US$),,36,575
Gross capital formation (current LCU),,37,576
Gross capital formation (constant 2010 US$),,38,577
Gross capital formation (annual % growth),,39,578
Gross capital formation (constant LCU),,40,579
Gross capital formation (% of GDP),,41,580
Imports of goods and services (current US$),,36,581
Imports of goods and services (current LCU),,37,582
Imports of goods and services (constant 2010 US$),,38,583
Imports of goods and services (annual % growth),,39,584
Imports of goods and services (constant LCU),,40,585
Imports of goods and services (% of GDP),,41,586
External balance on goods and services (current US$),,36,587
External balance on goods and services (current LCU),,37,588
External balance on goods and services (constant LCU),,40,589
External balance on goods and services (% of GDP),,41,590
Trade (% of GDP),,41,591
"Agriculture, value added per worker (constant 2010 US$)",,43,592
"Agriculture, value added (current US$)",,44,593
"Agriculture, value added (current LCU)",,45,594
"Agriculture, value added (constant 2010 US$)",,43,595
"Agriculture, value added (annual % growth)",,39,596
"Agriculture, value added (constant LCU)",,46,597
"Agriculture, value added (% of GDP)",,41,598
Financial intermediary services indirectly Measured (FISIM) (current LCU),,45,599
Financial intermediary services indirectly Measured (FISIM) (constant LCU),,46,600
"Industry, value added per worker (constant 2010 US$)",,43,601
"Manufacturing, value added (current US$)",,44,602
"Manufacturing, value added (current LCU)",,45,603
"Manufacturing, value added (constant 2010 US$)",,43,604
"Manufacturing, value added (annual % growth)",,39,605
"Manufacturing, value added (constant LCU)",,46,606
"Manufacturing, value added (% of GDP)",,41,607
"Industry, value added (current US$)",,44,608
"Industry, value added (current LCU)",,45,609
"Industry, value added (constant 2010 US$)",,43,610
"Industry, value added (annual % growth)",,39,611
"Industry, value added (constant LCU)",,46,612
"Industry, value added (% of GDP)",,41,613
Chemicals (% of value added in manufacturing),,41,614
"Food, beverages and tobacco (% of value added in manufacturing)",,41,615
Machinery and transport equipment (% of value added in manufacturing),,41,616
Other manufacturing (% of value added in manufacturing),,41,617
Medium and high-tech industry (% manufacturing value added),,41,618
Textiles and clothing (% of value added in manufacturing),,41,619
"Services, value added per worker (constant 2010 US$)",,43,620
"Services, value added (current US$)",,44,621
"Services, value added (current LCU)",,45,622
"Services, value added (constant 2010 US$)",,43,623
"Services, value added (annual % growth)",,39,624
"Services, value added (constant LCU)",,46,625
"Services, value added (% of GDP)",,41,626
Adjusted savings: education expenditure (current US$),,47,627
Adjusted savings: education expenditure (% of GNI),,47,628
Adjusted savings: carbon dioxide damage (current US$),,47,629
Adjusted savings: carbon dioxide damage (% of GNI),,47,630
Adjusted savings: net forest depletion (current US$),,47,631
Adjusted savings: net forest depletion (% of GNI),,47,632
Adjusted savings: consumption of fixed capital (current US$),,47,633
Adjusted savings: consumption of fixed capital (% of GNI),,47,634
Adjusted savings: mineral depletion (current US$),,47,635
Adjusted savings: mineral depletion (% of GNI),,47,636
Adjusted savings: energy depletion (current US$),,47,637
Adjusted savings: energy depletion (% of GNI),,47,638
Adjusted savings: particulate emission damage (current US$),,47,639
Adjusted savings: particulate emission damage (% of GNI),,47,640
Adjusted savings: natural resources depletion (% of GNI),,47,641
Adjusted savings: gross savings (% of GNI),,47,642
Adjusted savings: net national savings (current US$),,47,643
Adjusted savings: net national savings (% of GNI),,47,644
Adjusted net national income (current US$),,47,645
Adjusted net national income (constant 2010 US$),,47,646
Adjusted net national income (annual % growth),,47,647
Adjusted net national income per capita (current US$),,47,648
Adjusted net national income per capita (constant 2010 US$),,47,649
Adjusted net national income per capita (annual % growth),,47,650
"Adjusted net savings, including particulate emission damage (current US$)",,47,651
"Adjusted net savings, including particulate emission damage (% of GNI)",,47,652
"Adjusted net savings, excluding particulate emission damage (current US$)",,47,653
"Adjusted net savings, excluding particulate emission damage (% of GNI)",,47,654
Exports as a capacity to import (constant LCU),,48,655
Coal rents (% of GDP),,49,656
"Inflation, GDP deflator (annual %)",,24,657
"Inflation, GDP deflator: linked series (annual %)",,24,658
GDP deflator (base year varies by country),,24,659
GDP deflator: linked series (base year varies by country),,24,660
Discrepancy in expenditure estimate of GDP (current LCU),,37,661
Discrepancy in expenditure estimate of GDP (constant LCU),,40,662
Gross value added at factor cost (current US$),,50,663
Gross value added at factor cost (current LCU),,51,664
Gross value added at factor cost (constant 2010 US$),,52,665
Gross value added at factor cost (constant LCU),,53,666
Forest rents (% of GDP),,49,667
Mineral rents (% of GDP),,49,668
GDP (current US$),,50,669
GDP (current LCU),,51,670
GDP at market prices: linked series (current LCU),,51,671
GDP (constant 2010 US$),,52,672
GDP growth (annual %),,39,673
GDP (constant LCU),,53,674
"GDP, PPP (current international $)",,42,675
"GDP, PPP (constant 2011 international $)",,42,676
Natural gas rents (% of GDP),,49,677
GDP per capita (current US$),,50,678
GDP per capita (current LCU),,51,679
GDP per capita (constant 2010 US$),,52,680
GDP per capita growth (annual %),,39,681
GDP per capita (constant LCU),,53,682
"GDP per capita, PPP (current international $)",,42,683
"GDP per capita, PPP (constant 2011 international $)",,42,684
Oil rents (% of GDP),,49,685
Total natural resources rents (% of GDP),,49,686
Gross domestic savings (current US$),,50,687
Gross domestic savings (current LCU),,51,688
Gross domestic savings (% of GDP),,41,689
Gross domestic income (constant LCU),,48,690
"GNI, Atlas method (current US$)",,54,691
GNI (current US$),,50,692
GNI (current LCU),,51,693
GNI (constant 2010 US$),,52,694
GNI growth (annual %),,39,695
GNI (constant LCU),,53,696
"GNI, PPP (current international $)",,42,697
"GNI, PPP (constant 2011 international $)",,42,698
"GNI per capita, Atlas method (current US$)",,54,699
GNI per capita (current LCU),,51,700
GNI per capita (constant 2010 US$),,52,701
GNI per capita growth (annual %),,39,702
GNI per capita (constant LCU),,53,703
"GNI per capita, PPP (current international $)",,42,704
"GNI per capita, PPP (constant 2011 international $)",,42,705
Gross savings (current US$),,50,706
Gross savings (current LCU),,51,707
Gross savings (% of GNI),,41,708
Gross savings (% of GDP),,41,709
Net income from abroad (current US$),,50,710
Net income from abroad (current LCU),,51,711
Net income from abroad (constant LCU),,53,712
Net taxes on products (current US$),,50,713
Net taxes on products (current LCU),,51,714
Net taxes on products (constant LCU),,53,715
Net current transfers from abroad (current US$),,50,716
Net current transfers from abroad (current LCU),,51,717
Net current transfers from abroad (constant LCU),,53,718
Terms of trade adjustment (constant LCU),,48,719
DEC alternative conversion factor (LCU per US$),,24,720
"Official exchange rate (LCU per US$, period average)",,24,721
"PPP conversion factor, GDP (LCU per international $)",,42,722
"2005 PPP conversion factor, GDP (LCU per international $)",,42,723
Price level ratio of PPP conversion factor (GDP) to market exchange rate,,42,724
"PPP conversion factor, private consumption (LCU per international $)",,42,725
"2005 PPP conversion factor, private consumption (LCU per international $)",,42,726
Adequacy of social protection and labor programs (% of total welfare of beneficiary households),,55,727
Benefit incidence of social protection and labor programs to poorest quintile (% of total SPL benefits),,55,728
Coverage of social protection and labor programs (% of population),,55,729
Adequacy of unemployment benefits and ALMP (% of total welfare of beneficiary households),,55,730
Benefit incidence of unemployment benefits and ALMP to poorest quintile (% of total U/ALMP benefits),,55,731
Coverage of unemployment benefits and ALMP (% of population),,55,732
Coverage of unemployment benefits and ALMP in poorest quintile (% of population),,55,733
Coverage of unemployment benefits and ALMP in 2nd quintile (% of population),,55,734
Coverage of unemployment benefits and ALMP in 3rd quintile (% of population),,55,735
Coverage of unemployment benefits and ALMP in 4th quintile (% of population),,55,736
Coverage of unemployment benefits and ALMP in richest quintile (% of population),,55,737
Adequacy of social safety net programs (% of total welfare of beneficiary households),,55,738
Benefit incidence of social safety net programs to poorest quintile (% of total safety net benefits),,55,739
Coverage of social safety net programs (% of population),,55,740
Coverage of social safety net programs in poorest quintile (% of population),,55,741
Coverage of social safety net programs in 2nd quintile (% of population),,55,742
Coverage of social safety net programs in 3rd quintile (% of population),,55,743
Coverage of social safety net programs in 4th quintile (% of population),,55,744
Coverage of social safety net programs in richest quintile (% of population),,55,745
Adequacy of social insurance programs (% of total welfare of beneficiary households),,55,746
Benefit incidence of social insurance programs to poorest quintile (% of total social insurance benefits),,55,747
Coverage of social insurance programs (% of population),,55,748
Coverage of social insurance programs in poorest quintile (% of population),,55,749
Coverage of social insurance programs in 2nd quintile (% of population),,55,750
Coverage of social insurance programs in 3rd quintile (% of population),,55,751
Coverage of social insurance programs in 4th quintile (% of population),,55,752
Coverage of social insurance programs in richest quintile (% of population),,55,753
Real effective exchange rate index (2010 = 100),,24,754
"Literacy rate, youth female (% of females ages 15-24)",,56,755
"Literacy rate, youth (ages 15-24), gender parity index (GPI)",,56,756
"Literacy rate, youth male (% of males ages 15-24)",,56,757
"Literacy rate, youth total (% of people ages 15-24)",,56,758
"Literacy rate, adult female (% of females ages 15 and above)",,56,759
"Literacy rate, adult male (% of males ages 15 and above)",,56,760
"Literacy rate, adult total (% of people ages 15 and above)",,56,761
"Compulsory education, duration (years)",,56,762
"School enrollment, primary (gross), gender parity index (GPI)",,57,763
"School enrollment, primary and secondary (gross), gender parity index (GPI)",,57,764
"School enrollment, secondary (gross), gender parity index (GPI)",,57,765
"School enrollment, tertiary (gross), gender parity index (GPI)",,57,766
"Preprimary education, duration (years)",,58,767
"Pupil-teacher ratio, preprimary",,58,768
"School enrollment, preprimary (% gross)",,57,769
"School enrollment, preprimary, female (% gross)",,57,770
"School enrollment, preprimary, male (% gross)",,57,771
"Trained teachers in preprimary education, female (% of female teachers)",,58,772
"Trained teachers in preprimary education, male (% of male teachers)",,58,773
Trained teachers in preprimary education (% of total teachers),,58,774
Primary school starting age (years),,58,775
"Primary completion rate, female (% of relevant age group)",,56,776
"Primary completion rate, male (% of relevant age group)",,56,777
"Primary completion rate, total (% of relevant age group)",,56,778
"Educational attainment, at least completed primary, population 25+ years, female (%) (cumulative)",,56,779
"Educational attainment, at least completed primary, population 25+ years, male (%) (cumulative)",,56,780
"Educational attainment, at least completed primary, population 25+ years, total (%) (cumulative)",,56,781
"Primary education, duration (years)",,56,782
"Primary education, pupils",,57,783
"Primary education, pupils (% female)",,57,784
"Pupil-teacher ratio, primary",,58,785
"School enrollment, primary (% gross)",,57,786
"School enrollment, primary, female (% gross)",,57,787
"School enrollment, primary, male (% gross)",,57,788
"Gross intake ratio in first grade of primary education, female (% of relevant age group)",,59,789
"Gross intake ratio in first grade of primary education, male (% of relevant age group)",,59,790
"Gross intake ratio in first grade of primary education, total (% of relevant age group)",,59,791
"School enrollment, primary (% net)",,57,792
"School enrollment, primary, female (% net)",,57,793
"School enrollment, primary, male (% net)",,57,794
"Net intake rate in grade 1, female (% of official school-age population)",,59,795
"Net intake rate in grade 1, male (% of official school-age population)",,59,796
Net intake rate in grade 1 (% of official school-age population),,59,797
"Over-age students, primary, female (% of female enrollment)",,59,798
"Over-age students, primary, male (% of male enrollment)",,59,799
"Over-age students, primary (% of enrollment)",,59,800
"School enrollment, primary, private (% of total primary)",,57,801
"Persistence to grade 5, female (% of cohort)",,59,802
"Persistence to grade 5, male (% of cohort)",,59,803
"Persistence to grade 5, total (% of cohort)",,59,804
"Persistence to last grade of primary, female (% of cohort)",,59,805
"Persistence to last grade of primary, male (% of cohort)",,59,806
"Persistence to last grade of primary, total (% of cohort)",,59,807
"Repeaters, primary, female (% of female enrollment)",,59,808
"Repeaters, primary, male (% of male enrollment)",,59,809
"Repeaters, primary, total (% of total enrollment)",,59,810
"Trained teachers in primary education, female (% of female teachers)",,58,811
"Trained teachers in primary education, male (% of male teachers)",,58,812
Trained teachers in primary education (% of total teachers),,58,813
"Primary education, teachers",,58,814
"Primary education, teachers (% female)",,58,815
"Adjusted net enrollment rate, primary (% of primary school age children)",,57,816
"Adjusted net enrollment rate, primary, female (% of primary school age children)",,57,817
"Adjusted net enrollment rate, primary, male (% of primary school age children)",,57,818
"Children out of school, primary",,57,819
"Children out of school, primary, female",,57,820
"Children out of school, female (% of female primary school age)",,57,821
"Children out of school, primary, male",,57,822
"Children out of school, male (% of male primary school age)",,57,823
Children out of school (% of primary school age),,57,824
Lower secondary school starting age (years),,58,825
"Lower secondary completion rate, female (% of relevant age group)",,56,826
"Lower secondary completion rate, male (% of relevant age group)",,56,827
"Lower secondary completion rate, total (% of relevant age group)",,56,828
"Educational attainment, at least completed lower secondary, population 25+, female (%) (cumulative)",,56,829
"Educational attainment, at least completed lower secondary, population 25+, male (%) (cumulative)",,56,830
"Educational attainment, at least completed lower secondary, population 25+, total (%) (cumulative)",,56,831
"Educational attainment, at least completed post-secondary, population 25+, female (%) (cumulative)",,56,832
"Educational attainment, at least completed post-secondary, population 25+, male (%) (cumulative)",,56,833
"Educational attainment, at least completed post-secondary, population 25+, total (%) (cumulative)",,56,834
"Educational attainment, at least completed upper secondary, population 25+, female (%) (cumulative)",,56,835
